2025-09-08 07:21:42 INFO {'audio_repr': 'ar_eat.AR_EAT', 'weight_file': '/opt/gpfs/home/chushu/exp/eat/pre_4_AS2M/default_0_2025-09-05_16-17-52/checkpoint_last.pt', 'feature_d': 768, 'sample_rate': 16000, 'target_length': 1024, 'framework': 'fairseq', 'mode': 'finetune', 'prediction_mode': 'CLS_TOKEN', 'model_dir': '/opt/gpfs/home/chushu/codes/2506/EAT/EAT', 'batch_size': 64, 'lr_lineareval': 3e-05, 'report_per_epochs': 50, 'early_stop_epochs': 20, 'training_mask': 0.0, 'warmup_epochs': 5, 'mixup': 0.5, 'ft_bs': 128, 'ft_lr': 2.0, 'ft_early_stop_epochs': -1, 'ft_epochs': 200, 'ft_freq_mask': 30, 'ft_time_mask': 192, 'ft_noise': 0.0, 'ft_rrc': True, 'name': '', 'task_metadata': '/opt/gpfs/home/chushu/codes/2506/EAT/evar/evar/metadata/nsynth.csv', 'task_data': '/opt/gpfs/data/raw_data/nsynth/16k', 'unit_samples': 64000, 'id': 'default_0_2025-09-05_16-17-52-checkpoint_last_nsynth_81719882', 'task_name': 'nsynth', 'return_filename': False, 'mean': None, 'std': None, 'runtime_cfg': {'lr': 1e-05, 'seed': 42, 'hidden': (), 'standard_scaler': True, 'mixup': False, 'epochs': 200, 'early_stop_epochs': 20, 'id': '50d291e1'}}
2025-09-08 07:21:43 INFO  classes: ['bass', 'brass', 'flute', 'guitar', 'keyboard', 'mallet', 'organ', 'reed', 'string', 'synth_lead', 'vocal']
2025-09-08 07:21:43 INFO Train:289205, valid:12678, test:4096, multi label:False
2025-09-08 07:21:43 INFO  using cached embeddings: embs-default_0_2025-09-05_16-17-52-checkpoint_last_nsynth_81719882-train-1
2025-09-08 07:21:43 INFO  using cached embeddings: embs-default_0_2025-09-05_16-17-52-checkpoint_last_nsynth_81719882-valid-1
2025-09-08 07:21:43 INFO  using cached embeddings: embs-default_0_2025-09-05_16-17-52-checkpoint_last_nsynth_81719882-test-1
2025-09-08 07:21:49 INFO {'audio_repr': 'ar_eat.AR_EAT', 'weight_file': '/opt/gpfs/home/chushu/exp/eat/pre_4_AS2M/default_0_2025-09-05_16-17-52/checkpoint_last.pt', 'feature_d': 768, 'sample_rate': 16000, 'target_length': 1024, 'framework': 'fairseq', 'mode': 'finetune', 'prediction_mode': 'CLS_TOKEN', 'model_dir': '/opt/gpfs/home/chushu/codes/2506/EAT/EAT', 'batch_size': 64, 'lr_lineareval': 3e-05, 'report_per_epochs': 50, 'early_stop_epochs': 20, 'training_mask': 0.0, 'warmup_epochs': 5, 'mixup': 0.5, 'ft_bs': 128, 'ft_lr': 2.0, 'ft_early_stop_epochs': -1, 'ft_epochs': 200, 'ft_freq_mask': 30, 'ft_time_mask': 192, 'ft_noise': 0.0, 'ft_rrc': True, 'name': '', 'task_metadata': '/opt/gpfs/home/chushu/codes/2506/EAT/evar/evar/metadata/nsynth.csv', 'task_data': '/opt/gpfs/data/raw_data/nsynth/16k', 'unit_samples': 64000, 'id': 'default_0_2025-09-05_16-17-52-checkpoint_last_nsynth_81719882', 'task_name': 'nsynth', 'return_filename': False, 'mean': None, 'std': None, 'runtime_cfg': {'lr': 1e-05, 'seed': 42, 'hidden': (), 'standard_scaler': True, 'mixup': False, 'epochs': 200, 'early_stop_epochs': 20, 'id': '50d291e1'}}
2025-09-08 07:21:50 INFO  classes: ['bass', 'brass', 'flute', 'guitar', 'keyboard', 'mallet', 'organ', 'reed', 'string', 'synth_lead', 'vocal']
2025-09-08 07:21:50 INFO Train:289205, valid:12678, test:4096, multi label:False
2025-09-08 07:21:50 INFO  using cached embeddings: embs-default_0_2025-09-05_16-17-52-checkpoint_last_nsynth_81719882-train-1
2025-09-08 07:21:51 INFO  using cached embeddings: embs-default_0_2025-09-05_16-17-52-checkpoint_last_nsynth_81719882-valid-1
2025-09-08 07:21:51 INFO  using cached embeddings: embs-default_0_2025-09-05_16-17-52-checkpoint_last_nsynth_81719882-test-1
2025-09-08 07:21:51 INFO 🚀 Started Linear evaluation:
2025-09-08 07:21:53 INFO  stats|train: mean=0.0000, std=1.0000
2025-09-08 07:21:53 INFO  stats|valid: mean=-0.0014, std=0.9460
2025-09-08 07:21:53 INFO Training model: MLP(
  (mlp): Sequential(
    (0): Linear(in_features=768, out_features=11, bias=True)
  )
)
2025-09-08 07:21:53 INFO Details - metric: acc, loss: <function loss_nll_with_logits at 0x7f11a27509d0>, optimizer: Adam (
Parameter Group 0
    amsgrad: False
    betas: (0.9, 0.999)
    capturable: False
    decoupled_weight_decay: False
    differentiable: False
    eps: 1e-08
    foreach: None
    fused: None
    lr: 1e-05
    maximize: False
    weight_decay: 1e-08
), n_class: 11
2025-09-08 07:21:57 INFO epoch 0001/200: lr: 0.0000100: loss=36.885835 val_acc=0.4529894 val_loss=31.9102325
2025-09-08 07:22:00 INFO epoch 0002/200: lr: 0.0000100: loss=29.346129 val_acc=0.5101751 val_loss=27.7857761
2025-09-08 07:22:03 INFO epoch 0003/200: lr: 0.0000100: loss=26.223005 val_acc=0.5429879 val_loss=25.6594734
2025-09-08 07:22:06 INFO epoch 0004/200: lr: 0.0000100: loss=24.258872 val_acc=0.5683862 val_loss=24.2524910
2025-09-08 07:22:10 INFO epoch 0005/200: lr: 0.0000100: loss=22.851438 val_acc=0.5851081 val_loss=23.2704887
2025-09-08 07:22:13 INFO epoch 0006/200: lr: 0.0000100: loss=21.771653 val_acc=0.6004102 val_loss=22.5261555
2025-09-08 07:22:16 INFO epoch 0007/200: lr: 0.0000100: loss=20.907501 val_acc=0.6104275 val_loss=21.9382095
2025-09-08 07:22:20 INFO epoch 0008/200: lr: 0.0000100: loss=20.196671 val_acc=0.6217858 val_loss=21.4577675
2025-09-08 07:22:23 INFO epoch 0009/200: lr: 0.0000100: loss=19.596308 val_acc=0.6262817 val_loss=21.0819302
2025-09-08 07:22:26 INFO epoch 0010/200: lr: 0.0000100: loss=19.079042 val_acc=0.6325130 val_loss=20.7621994
2025-09-08 07:22:30 INFO epoch 0011/200: lr: 0.0000100: loss=18.625267 val_acc=0.6392175 val_loss=20.4531517
2025-09-08 07:22:33 INFO epoch 0012/200: lr: 0.0000100: loss=18.222196 val_acc=0.6448178 val_loss=20.2281380
2025-09-08 07:22:36 INFO epoch 0013/200: lr: 0.0000100: loss=17.860955 val_acc=0.6485250 val_loss=20.0633221
2025-09-08 07:22:40 INFO epoch 0014/200: lr: 0.0000100: loss=17.534787 val_acc=0.6511279 val_loss=19.8866920
2025-09-08 07:22:43 INFO epoch 0015/200: lr: 0.0000100: loss=17.237218 val_acc=0.6518378 val_loss=19.7731915
2025-09-08 07:22:46 INFO epoch 0016/200: lr: 0.0000100: loss=16.963120 val_acc=0.6556239 val_loss=19.6043854
2025-09-08 07:22:50 INFO epoch 0017/200: lr: 0.0000100: loss=16.708786 val_acc=0.6579113 val_loss=19.4866543
2025-09-08 07:22:53 INFO epoch 0018/200: lr: 0.0000100: loss=16.472919 val_acc=0.6617763 val_loss=19.3374519
2025-09-08 07:22:56 INFO epoch 0019/200: lr: 0.0000100: loss=16.253337 val_acc=0.6628017 val_loss=19.2517300
2025-09-08 07:23:00 INFO epoch 0020/200: lr: 0.0000100: loss=16.047074 val_acc=0.6668244 val_loss=19.1693344
2025-09-08 07:23:03 INFO epoch 0021/200: lr: 0.0000100: loss=15.852634 val_acc=0.6683231 val_loss=19.0806503
2025-09-08 07:23:06 INFO epoch 0022/200: lr: 0.0000100: loss=15.669048 val_acc=0.6690330 val_loss=19.0048428
2025-09-08 07:23:10 INFO epoch 0023/200: lr: 0.0000100: loss=15.494515 val_acc=0.6707683 val_loss=18.9099865
2025-09-08 07:23:13 INFO epoch 0024/200: lr: 0.0000100: loss=15.329253 val_acc=0.6727402 val_loss=18.8650780
2025-09-08 07:23:16 INFO epoch 0025/200: lr: 0.0000100: loss=15.172013 val_acc=0.6742388 val_loss=18.7621613
2025-09-08 07:23:20 INFO epoch 0026/200: lr: 0.0000100: loss=15.022805 val_acc=0.6754220 val_loss=18.7096901
2025-09-08 07:23:23 INFO epoch 0027/200: lr: 0.0000100: loss=14.879711 val_acc=0.6758164 val_loss=18.6630745
2025-09-08 07:23:26 INFO epoch 0028/200: lr: 0.0000100: loss=14.743078 val_acc=0.6773939 val_loss=18.5903835
2025-09-08 07:23:30 INFO epoch 0029/200: lr: 0.0000100: loss=14.611743 val_acc=0.6770784 val_loss=18.5479584
2025-09-08 07:23:33 INFO epoch 0030/200: lr: 0.0000100: loss=14.486976 val_acc=0.6783404 val_loss=18.5230923
2025-09-08 07:23:36 INFO epoch 0031/200: lr: 0.0000100: loss=14.367117 val_acc=0.6798391 val_loss=18.4692211
2025-09-08 07:23:40 INFO epoch 0032/200: lr: 0.0000100: loss=14.252998 val_acc=0.6803124 val_loss=18.4413223
2025-09-08 07:23:43 INFO epoch 0033/200: lr: 0.0000100: loss=14.142080 val_acc=0.6820476 val_loss=18.3911610
2025-09-08 07:23:46 INFO epoch 0034/200: lr: 0.0000100: loss=14.035329 val_acc=0.6811800 val_loss=18.3761635
2025-09-08 07:23:50 INFO epoch 0035/200: lr: 0.0000100: loss=13.932229 val_acc=0.6836252 val_loss=18.3168182
2025-09-08 07:23:53 INFO epoch 0036/200: lr: 0.0000100: loss=13.833572 val_acc=0.6829153 val_loss=18.2634926
2025-09-08 07:23:56 INFO epoch 0037/200: lr: 0.0000100: loss=13.737745 val_acc=0.6844139 val_loss=18.2370090
2025-09-08 07:24:00 INFO epoch 0038/200: lr: 0.0000100: loss=13.644809 val_acc=0.6858337 val_loss=18.2184734
2025-09-08 07:24:03 INFO epoch 0039/200: lr: 0.0000100: loss=13.554549 val_acc=0.6872535 val_loss=18.1898842
2025-09-08 07:24:06 INFO epoch 0040/200: lr: 0.0000100: loss=13.467566 val_acc=0.6865436 val_loss=18.1419678
2025-09-08 07:24:10 INFO epoch 0041/200: lr: 0.0000100: loss=13.383146 val_acc=0.6871746 val_loss=18.1221752
2025-09-08 07:24:13 INFO epoch 0042/200: lr: 0.0000100: loss=13.301327 val_acc=0.6879634 val_loss=18.1046314
2025-09-08 07:24:16 INFO epoch 0043/200: lr: 0.0000100: loss=13.222320 val_acc=0.6881212 val_loss=18.0923443
2025-09-08 07:24:19 INFO epoch 0044/200: lr: 0.0000100: loss=13.145747 val_acc=0.6906452 val_loss=18.0079288
2025-09-08 07:24:23 INFO epoch 0045/200: lr: 0.0000100: loss=13.070761 val_acc=0.6900142 val_loss=18.0048161
2025-09-08 07:24:26 INFO epoch 0046/200: lr: 0.0000100: loss=12.997816 val_acc=0.6920650 val_loss=17.9917316
2025-09-08 07:24:29 INFO epoch 0047/200: lr: 0.0000100: loss=12.926480 val_acc=0.6912762 val_loss=17.9720631
2025-09-08 07:24:32 INFO epoch 0048/200: lr: 0.0000100: loss=12.857597 val_acc=0.6933270 val_loss=17.9576054
2025-09-08 07:24:36 INFO epoch 0049/200: lr: 0.0000100: loss=12.790753 val_acc=0.6923016 val_loss=17.9100685
2025-09-08 07:24:39 INFO epoch 0050/200: lr: 0.0000100: loss=12.725699 val_acc=0.6927749 val_loss=17.8942795
2025-09-08 07:24:43 INFO epoch 0051/200: lr: 0.0000100: loss=12.662093 val_acc=0.6943524 val_loss=17.8959293
2025-09-08 07:24:46 INFO epoch 0052/200: lr: 0.0000100: loss=12.600042 val_acc=0.6942735 val_loss=17.8671818
2025-09-08 07:24:49 INFO epoch 0053/200: lr: 0.0000100: loss=12.538963 val_acc=0.6934848 val_loss=17.8624763
2025-09-08 07:24:52 INFO epoch 0054/200: lr: 0.0000100: loss=12.480235 val_acc=0.6934059 val_loss=17.8640976
2025-09-08 07:24:56 INFO epoch 0055/200: lr: 0.0000100: loss=12.422461 val_acc=0.6941158 val_loss=17.8138371
2025-09-08 07:24:59 INFO epoch 0056/200: lr: 0.0000100: loss=12.366077 val_acc=0.6944313 val_loss=17.7817345
2025-09-08 07:25:02 INFO epoch 0057/200: lr: 0.0000100: loss=12.310851 val_acc=0.6940369 val_loss=17.7834263
2025-09-08 07:25:06 INFO epoch 0058/200: lr: 0.0000100: loss=12.256913 val_acc=0.6949834 val_loss=17.7485676
2025-09-08 07:25:09 INFO epoch 0059/200: lr: 0.0000100: loss=12.204383 val_acc=0.6931693 val_loss=17.7691803
2025-09-08 07:25:12 INFO epoch 0060/200: lr: 0.0000100: loss=12.152444 val_acc=0.6967187 val_loss=17.7342625
2025-09-08 07:25:15 INFO epoch 0061/200: lr: 0.0000100: loss=12.102173 val_acc=0.6955356 val_loss=17.7364368
2025-09-08 07:25:19 INFO epoch 0062/200: lr: 0.0000100: loss=12.052776 val_acc=0.6949834 val_loss=17.7188549
2025-09-08 07:25:22 INFO epoch 0063/200: lr: 0.0000100: loss=12.004862 val_acc=0.6964821 val_loss=17.6819515
2025-09-08 07:25:25 INFO epoch 0064/200: lr: 0.0000100: loss=11.957752 val_acc=0.6964821 val_loss=17.6800175
2025-09-08 07:25:28 INFO epoch 0065/200: lr: 0.0000100: loss=11.911935 val_acc=0.6970342 val_loss=17.6654720
2025-09-08 07:25:32 INFO epoch 0066/200: lr: 0.0000100: loss=11.866934 val_acc=0.6964821 val_loss=17.6736603
2025-09-08 07:25:35 INFO epoch 0067/200: lr: 0.0000100: loss=11.822198 val_acc=0.6982963 val_loss=17.6547318
2025-09-08 07:25:38 INFO epoch 0068/200: lr: 0.0000100: loss=11.778098 val_acc=0.6979019 val_loss=17.6280994
2025-09-08 07:25:42 INFO epoch 0069/200: lr: 0.0000100: loss=11.735147 val_acc=0.6986118 val_loss=17.6319828
2025-09-08 07:25:45 INFO epoch 0070/200: lr: 0.0000100: loss=11.693169 val_acc=0.6982174 val_loss=17.6326942
2025-09-08 07:25:48 INFO epoch 0071/200: lr: 0.0000100: loss=11.652005 val_acc=0.6980596 val_loss=17.6144829
2025-09-08 07:25:51 INFO epoch 0072/200: lr: 0.0000100: loss=11.611411 val_acc=0.6994794 val_loss=17.5539932
2025-09-08 07:25:55 INFO epoch 0073/200: lr: 0.0000100: loss=11.571357 val_acc=0.6986906 val_loss=17.6142368
2025-09-08 07:25:58 INFO epoch 0074/200: lr: 0.0000100: loss=11.532009 val_acc=0.6982963 val_loss=17.5950794
2025-09-08 07:26:01 INFO epoch 0075/200: lr: 0.0000100: loss=11.493608 val_acc=0.6998738 val_loss=17.5602932
2025-09-08 07:26:04 INFO epoch 0076/200: lr: 0.0000100: loss=11.455564 val_acc=0.6997160 val_loss=17.5497112
2025-09-08 07:26:08 INFO epoch 0077/200: lr: 0.0000100: loss=11.418045 val_acc=0.6991639 val_loss=17.5244617
2025-09-08 07:26:11 INFO epoch 0078/200: lr: 0.0000100: loss=11.381665 val_acc=0.6993217 val_loss=17.5398388
2025-09-08 07:26:14 INFO epoch 0079/200: lr: 0.0000100: loss=11.345602 val_acc=0.6992428 val_loss=17.5416317
2025-09-08 07:26:17 INFO epoch 0080/200: lr: 0.0000100: loss=11.310088 val_acc=0.7001104 val_loss=17.4956150
2025-09-08 07:26:21 INFO epoch 0081/200: lr: 0.0000100: loss=11.275366 val_acc=0.7020035 val_loss=17.4918995
2025-09-08 07:26:24 INFO epoch 0082/200: lr: 0.0000100: loss=11.241445 val_acc=0.7024767 val_loss=17.4974403
2025-09-08 07:26:27 INFO epoch 0083/200: lr: 0.0000100: loss=11.207718 val_acc=0.7018457 val_loss=17.4976711
2025-09-08 07:26:30 INFO epoch 0084/200: lr: 0.0000100: loss=11.174704 val_acc=0.7013725 val_loss=17.4890518
2025-09-08 07:26:34 INFO epoch 0085/200: lr: 0.0000100: loss=11.142068 val_acc=0.7026345 val_loss=17.4873428
2025-09-08 07:26:37 INFO epoch 0086/200: lr: 0.0000100: loss=11.109517 val_acc=0.7020035 val_loss=17.4977226
2025-09-08 07:26:40 INFO epoch 0087/200: lr: 0.0000100: loss=11.078446 val_acc=0.7022401 val_loss=17.4872570
2025-09-08 07:26:43 INFO epoch 0088/200: lr: 0.0000100: loss=11.047134 val_acc=0.7027134 val_loss=17.4769020
2025-09-08 07:26:46 INFO epoch 0089/200: lr: 0.0000100: loss=11.016166 val_acc=0.7026345 val_loss=17.4816303
2025-09-08 07:26:50 INFO epoch 0090/200: lr: 0.0000100: loss=10.986422 val_acc=0.7034233 val_loss=17.4697323
2025-09-08 07:26:53 INFO epoch 0091/200: lr: 0.0000100: loss=10.956631 val_acc=0.7046064 val_loss=17.4405117
2025-09-08 07:26:56 INFO epoch 0092/200: lr: 0.0000100: loss=10.927587 val_acc=0.7036599 val_loss=17.4462833
2025-09-08 07:26:59 INFO epoch 0093/200: lr: 0.0000100: loss=10.898660 val_acc=0.7054740 val_loss=17.4338913
2025-09-08 07:27:02 INFO epoch 0094/200: lr: 0.0000100: loss=10.870216 val_acc=0.7037388 val_loss=17.4300804
2025-09-08 07:27:05 INFO epoch 0095/200: lr: 0.0000100: loss=10.842666 val_acc=0.7048430 val_loss=17.4295616
2025-09-08 07:27:09 INFO epoch 0096/200: lr: 0.0000100: loss=10.815399 val_acc=0.7043698 val_loss=17.4396076
2025-09-08 07:27:12 INFO epoch 0097/200: lr: 0.0000100: loss=10.788036 val_acc=0.7051585 val_loss=17.4078560
2025-09-08 07:27:15 INFO epoch 0098/200: lr: 0.0000100: loss=10.761400 val_acc=0.7043698 val_loss=17.4187756
2025-09-08 07:27:18 INFO epoch 0099/200: lr: 0.0000100: loss=10.734772 val_acc=0.7061051 val_loss=17.3931961
2025-09-08 07:27:21 INFO epoch 0100/200: lr: 0.0000100: loss=10.708508 val_acc=0.7050008 val_loss=17.3937569
2025-09-08 07:27:25 INFO epoch 0101/200: lr: 0.0000100: loss=10.682770 val_acc=0.7049219 val_loss=17.3871593
2025-09-08 07:27:28 INFO epoch 0102/200: lr: 0.0000100: loss=10.657822 val_acc=0.7057107 val_loss=17.3919296
2025-09-08 07:27:31 INFO epoch 0103/200: lr: 0.0000100: loss=10.632629 val_acc=0.7052374 val_loss=17.4033737
2025-09-08 07:27:34 INFO epoch 0104/200: lr: 0.0000100: loss=10.607895 val_acc=0.7064994 val_loss=17.3463612
2025-09-08 07:27:38 INFO epoch 0105/200: lr: 0.0000100: loss=10.584205 val_acc=0.7057896 val_loss=17.3920956
2025-09-08 07:27:41 INFO epoch 0106/200: lr: 0.0000100: loss=10.559617 val_acc=0.7056318 val_loss=17.3473225
2025-09-08 07:27:44 INFO epoch 0107/200: lr: 0.0000100: loss=10.535630 val_acc=0.7052374 val_loss=17.4214306
2025-09-08 07:27:47 INFO epoch 0108/200: lr: 0.0000100: loss=10.512553 val_acc=0.7054740 val_loss=17.3805256
2025-09-08 07:27:51 INFO epoch 0109/200: lr: 0.0000100: loss=10.489527 val_acc=0.7062628 val_loss=17.3612690
2025-09-08 07:27:54 INFO epoch 0110/200: lr: 0.0000100: loss=10.466345 val_acc=0.7073671 val_loss=17.3305874
2025-09-08 07:27:57 INFO epoch 0111/200: lr: 0.0000100: loss=10.443677 val_acc=0.7064206 val_loss=17.3515110
2025-09-08 07:28:00 INFO epoch 0112/200: lr: 0.0000100: loss=10.421395 val_acc=0.7068938 val_loss=17.3746643
2025-09-08 07:28:04 INFO epoch 0113/200: lr: 0.0000100: loss=10.399715 val_acc=0.7060262 val_loss=17.3944187
2025-09-08 07:28:07 INFO epoch 0114/200: lr: 0.0000100: loss=10.378155 val_acc=0.7065783 val_loss=17.3567924
2025-09-08 07:28:10 INFO epoch 0115/200: lr: 0.0000100: loss=10.356499 val_acc=0.7064206 val_loss=17.3628197
2025-09-08 07:28:14 INFO epoch 0116/200: lr: 0.0000100: loss=10.335478 val_acc=0.7073671 val_loss=17.3616314
2025-09-08 07:28:17 INFO epoch 0117/200: lr: 0.0000100: loss=10.314652 val_acc=0.7078404 val_loss=17.3445435
2025-09-08 07:28:21 INFO epoch 0118/200: lr: 0.0000100: loss=10.293954 val_acc=0.7073671 val_loss=17.2912521
2025-09-08 07:28:24 INFO epoch 0119/200: lr: 0.0000100: loss=10.273266 val_acc=0.7073671 val_loss=17.3352757
2025-09-08 07:28:27 INFO epoch 0120/200: lr: 0.0000100: loss=10.253257 val_acc=0.7068150 val_loss=17.3200550
2025-09-08 07:28:30 INFO epoch 0121/200: lr: 0.0000100: loss=10.233078 val_acc=0.7071305 val_loss=17.3402634
2025-09-08 07:28:34 INFO epoch 0122/200: lr: 0.0000100: loss=10.213451 val_acc=0.7079192 val_loss=17.3442783
2025-09-08 07:28:37 INFO epoch 0123/200: lr: 0.0000100: loss=10.194365 val_acc=0.7079192 val_loss=17.3117180
2025-09-08 07:28:40 INFO epoch 0124/200: lr: 0.0000100: loss=10.175049 val_acc=0.7070516 val_loss=17.3367863
2025-09-08 07:28:43 INFO epoch 0125/200: lr: 0.0000100: loss=10.155964 val_acc=0.7068938 val_loss=17.3121166
2025-09-08 07:28:47 INFO epoch 0126/200: lr: 0.0000100: loss=10.137163 val_acc=0.7072093 val_loss=17.3099232
2025-09-08 07:28:50 INFO epoch 0127/200: lr: 0.0000100: loss=10.118112 val_acc=0.7068938 val_loss=17.2881107
2025-09-08 07:28:53 INFO epoch 0128/200: lr: 0.0000100: loss=10.099909 val_acc=0.7063417 val_loss=17.3066692
2025-09-08 07:28:56 INFO epoch 0129/200: lr: 0.0000100: loss=10.081295 val_acc=0.7074460 val_loss=17.3232288
2025-09-08 07:29:00 INFO epoch 0130/200: lr: 0.0000100: loss=10.063430 val_acc=0.7064994 val_loss=17.3013496
2025-09-08 07:29:03 INFO epoch 0131/200: lr: 0.0000100: loss=10.045808 val_acc=0.7064206 val_loss=17.2897758
2025-09-08 07:29:06 INFO epoch 0132/200: lr: 0.0000100: loss=10.027948 val_acc=0.7076037 val_loss=17.2575226
2025-09-08 07:29:09 INFO epoch 0133/200: lr: 0.0000100: loss=10.010639 val_acc=0.7061839 val_loss=17.2979946
2025-09-08 07:29:13 INFO epoch 0134/200: lr: 0.0000100: loss=9.993745 val_acc=0.7066572 val_loss=17.2629318
2025-09-08 07:29:16 INFO epoch 0135/200: lr: 0.0000100: loss=9.976889 val_acc=0.7070516 val_loss=17.2827415
2025-09-08 07:29:19 INFO epoch 0136/200: lr: 0.0000100: loss=9.960047 val_acc=0.7055529 val_loss=17.3267403
2025-09-08 07:29:22 INFO epoch 0137/200: lr: 0.0000100: loss=9.943542 val_acc=0.7056318 val_loss=17.3140297
2025-09-08 07:29:26 INFO epoch 0138/200: lr: 0.0000100: loss=9.926845 val_acc=0.7066572 val_loss=17.2864494
2025-09-08 07:29:29 INFO epoch 0139/200: lr: 0.0000100: loss=9.910559 val_acc=0.7069727 val_loss=17.2928143
2025-09-08 07:29:32 INFO epoch 0140/200: lr: 0.0000100: loss=9.894602 val_acc=0.7064206 val_loss=17.2830086
2025-09-08 07:29:35 INFO epoch 0141/200: lr: 0.0000100: loss=9.878320 val_acc=0.7064994 val_loss=17.3037758
2025-09-08 07:29:38 INFO epoch 0142/200: lr: 0.0000100: loss=9.862544 val_acc=0.7062628 val_loss=17.3022251
2025-09-08 07:29:42 INFO epoch 0143/200: lr: 0.0000100: loss=9.846682 val_acc=0.7064206 val_loss=17.3177853
2025-09-08 07:29:42 INFO Training complete in 7m 49s
2025-09-08 07:29:42 INFO Best val_acc@123 = 0.7079192301624861
2025-09-08 07:29:42 INFO Best val_loss@123 = 17.311717987060547
2025-09-08 07:29:42 INFO  stats|test: mean=-0.0014, std=0.9473
2025-09-08 07:29:42 INFO Linear evaluation: default_0_2025-09-05_16-17-52-checkpoint_last_nsynth_233989d8 nsynth -> 0.70703
{'audio_repr': 'ar_eat.AR_EAT', 'weight_file': '/opt/gpfs/home/chushu/exp/eat/pre_4_AS2M/default_0_2025-09-05_16-17-52/checkpoint_last.pt', 'feature_d': 768, 'sample_rate': 16000, 'target_length': 1024, 'framework': 'fairseq', 'mode': 'finetune', 'prediction_mode': 'CLS_TOKEN', 'model_dir': '/opt/gpfs/home/chushu/codes/2506/EAT/EAT', 'batch_size': 64, 'lr_lineareval': 3e-05, 'report_per_epochs': 50, 'early_stop_epochs': 20, 'training_mask': 0.0, 'warmup_epochs': 5, 'mixup': 0.5, 'ft_bs': 128, 'ft_lr': 2.0, 'ft_early_stop_epochs': -1, 'ft_epochs': 200, 'ft_freq_mask': 30, 'ft_time_mask': 192, 'ft_noise': 0.0, 'ft_rrc': True, 'name': '', 'task_metadata': '/opt/gpfs/home/chushu/codes/2506/EAT/evar/evar/metadata/nsynth.csv', 'task_data': '/opt/gpfs/data/raw_data/nsynth/16k', 'unit_samples': 64000, 'id': 'default_0_2025-09-05_16-17-52-checkpoint_last_nsynth_81719882', 'task_name': 'nsynth', 'return_filename': False, 'mean': None, 'std': None, 'runtime_cfg': {'lr': 1e-05, 'seed': 42, 'hidden': (), 'standard_scaler': True, 'mixup': False, 'epochs': 200, 'early_stop_epochs': 20, 'id': '50d291e1'}}
/opt/gpfs/home/chushu/codes/2506/EAT/evar/logs/default_0_2025-09-05_16-17-52-checkpoint_last_nsynth_81719882/default-0-2025-09-05-16-17-52-checkpoint-last-nsynth-LE_233989d8_0.70703.csv
2025-09-08 07:29:42 INFO  -> /opt/gpfs/home/chushu/codes/2506/EAT/evar/results/scores.csv
2025-09-08 07:29:48 INFO {'audio_repr': 'ar_eat.AR_EAT', 'weight_file': '/opt/gpfs/home/chushu/exp/eat/pre_4_AS2M/default_0_2025-09-05_16-17-52/checkpoint_last.pt', 'feature_d': 768, 'sample_rate': 16000, 'target_length': 1024, 'framework': 'fairseq', 'mode': 'finetune', 'prediction_mode': 'CLS_TOKEN', 'model_dir': '/opt/gpfs/home/chushu/codes/2506/EAT/EAT', 'batch_size': 64, 'lr_lineareval': 3e-05, 'report_per_epochs': 50, 'early_stop_epochs': 20, 'training_mask': 0.0, 'warmup_epochs': 5, 'mixup': 0.5, 'ft_bs': 128, 'ft_lr': 2.0, 'ft_early_stop_epochs': -1, 'ft_epochs': 200, 'ft_freq_mask': 30, 'ft_time_mask': 192, 'ft_noise': 0.0, 'ft_rrc': True, 'name': '', 'task_metadata': '/opt/gpfs/home/chushu/codes/2506/EAT/evar/evar/metadata/nsynth.csv', 'task_data': '/opt/gpfs/data/raw_data/nsynth/16k', 'unit_samples': 64000, 'id': 'default_0_2025-09-05_16-17-52-checkpoint_last_nsynth_81719882', 'task_name': 'nsynth', 'return_filename': False, 'mean': None, 'std': None, 'runtime_cfg': {'lr': 1e-05, 'seed': 43, 'hidden': (), 'standard_scaler': True, 'mixup': False, 'epochs': 200, 'early_stop_epochs': 20, 'id': '7d7f1d32'}}
2025-09-08 07:29:49 INFO  classes: ['bass', 'brass', 'flute', 'guitar', 'keyboard', 'mallet', 'organ', 'reed', 'string', 'synth_lead', 'vocal']
2025-09-08 07:29:49 INFO Train:289205, valid:12678, test:4096, multi label:False
2025-09-08 07:29:49 INFO  using cached embeddings: embs-default_0_2025-09-05_16-17-52-checkpoint_last_nsynth_81719882-train-1
2025-09-08 07:29:49 INFO  using cached embeddings: embs-default_0_2025-09-05_16-17-52-checkpoint_last_nsynth_81719882-valid-1
2025-09-08 07:29:49 INFO  using cached embeddings: embs-default_0_2025-09-05_16-17-52-checkpoint_last_nsynth_81719882-test-1
2025-09-08 07:29:49 INFO 🚀 Started Linear evaluation:
2025-09-08 07:29:51 INFO  stats|train: mean=0.0000, std=1.0000
2025-09-08 07:29:51 INFO  stats|valid: mean=-0.0014, std=0.9460
2025-09-08 07:29:51 INFO Training model: MLP(
  (mlp): Sequential(
    (0): Linear(in_features=768, out_features=11, bias=True)
  )
)
2025-09-08 07:29:51 INFO Details - metric: acc, loss: <function loss_nll_with_logits at 0x7facb4e749d0>, optimizer: Adam (
Parameter Group 0
    amsgrad: False
    betas: (0.9, 0.999)
    capturable: False
    decoupled_weight_decay: False
    differentiable: False
    eps: 1e-08
    foreach: None
    fused: None
    lr: 1e-05
    maximize: False
    weight_decay: 1e-08
), n_class: 11
2025-09-08 07:29:55 INFO epoch 0001/200: lr: 0.0000100: loss=37.026894 val_acc=0.4342168 val_loss=32.2634239
2025-09-08 07:29:58 INFO epoch 0002/200: lr: 0.0000100: loss=29.496193 val_acc=0.5070989 val_loss=28.1369343
2025-09-08 07:30:01 INFO epoch 0003/200: lr: 0.0000100: loss=26.302124 val_acc=0.5434611 val_loss=25.9501839
2025-09-08 07:30:04 INFO epoch 0004/200: lr: 0.0000100: loss=24.298786 val_acc=0.5679918 val_loss=24.5504532
2025-09-08 07:30:08 INFO epoch 0005/200: lr: 0.0000100: loss=22.881822 val_acc=0.5847926 val_loss=23.5890121
2025-09-08 07:30:11 INFO epoch 0006/200: lr: 0.0000100: loss=21.801078 val_acc=0.6020666 val_loss=22.7970734
2025-09-08 07:30:14 INFO epoch 0007/200: lr: 0.0000100: loss=20.933751 val_acc=0.6100331 val_loss=22.2278976
2025-09-08 07:30:17 INFO epoch 0008/200: lr: 0.0000100: loss=20.219868 val_acc=0.6199716 val_loss=21.7320290
2025-09-08 07:30:20 INFO epoch 0009/200: lr: 0.0000100: loss=19.616564 val_acc=0.6301467 val_loss=21.3225899
2025-09-08 07:30:23 INFO epoch 0010/200: lr: 0.0000100: loss=19.096832 val_acc=0.6346427 val_loss=21.0106106
2025-09-08 07:30:26 INFO epoch 0011/200: lr: 0.0000100: loss=18.645354 val_acc=0.6405584 val_loss=20.7127743
2025-09-08 07:30:29 INFO epoch 0012/200: lr: 0.0000100: loss=18.243408 val_acc=0.6452122 val_loss=20.4920254
2025-09-08 07:30:33 INFO epoch 0013/200: lr: 0.0000100: loss=17.881924 val_acc=0.6490771 val_loss=20.2318554
2025-09-08 07:30:36 INFO epoch 0014/200: lr: 0.0000100: loss=17.554433 val_acc=0.6517590 val_loss=20.0410366
2025-09-08 07:30:39 INFO epoch 0015/200: lr: 0.0000100: loss=17.254890 val_acc=0.6537309 val_loss=19.8804512
2025-09-08 07:30:42 INFO epoch 0016/200: lr: 0.0000100: loss=16.979218 val_acc=0.6564127 val_loss=19.7597752
2025-09-08 07:30:45 INFO epoch 0017/200: lr: 0.0000100: loss=16.725371 val_acc=0.6597255 val_loss=19.6413822
2025-09-08 07:30:48 INFO epoch 0018/200: lr: 0.0000100: loss=16.490196 val_acc=0.6620918 val_loss=19.4803982
2025-09-08 07:30:52 INFO epoch 0019/200: lr: 0.0000100: loss=16.270396 val_acc=0.6660357 val_loss=19.3746986
2025-09-08 07:30:55 INFO epoch 0020/200: lr: 0.0000100: loss=16.062856 val_acc=0.6689541 val_loss=19.2833347
2025-09-08 07:30:58 INFO epoch 0021/200: lr: 0.0000100: loss=15.869397 val_acc=0.6695062 val_loss=19.2020893
2025-09-08 07:31:01 INFO epoch 0022/200: lr: 0.0000100: loss=15.685858 val_acc=0.6728191 val_loss=19.0968094
2025-09-08 07:31:04 INFO epoch 0023/200: lr: 0.0000100: loss=15.511024 val_acc=0.6737656 val_loss=19.0164280
2025-09-08 07:31:08 INFO epoch 0024/200: lr: 0.0000100: loss=15.346568 val_acc=0.6759741 val_loss=18.9414806
2025-09-08 07:31:11 INFO epoch 0025/200: lr: 0.0000100: loss=15.189801 val_acc=0.6769206 val_loss=18.8488693
2025-09-08 07:31:14 INFO epoch 0026/200: lr: 0.0000100: loss=15.039794 val_acc=0.6789714 val_loss=18.7740059
2025-09-08 07:31:17 INFO epoch 0027/200: lr: 0.0000100: loss=14.896720 val_acc=0.6785771 val_loss=18.7713413
2025-09-08 07:31:20 INFO epoch 0028/200: lr: 0.0000100: loss=14.759530 val_acc=0.6798391 val_loss=18.6915169
2025-09-08 07:31:23 INFO epoch 0029/200: lr: 0.0000100: loss=14.628315 val_acc=0.6811011 val_loss=18.6509705
2025-09-08 07:31:27 INFO epoch 0030/200: lr: 0.0000100: loss=14.502832 val_acc=0.6811800 val_loss=18.5934486
2025-09-08 07:31:30 INFO epoch 0031/200: lr: 0.0000100: loss=14.381599 val_acc=0.6828364 val_loss=18.5570278
2025-09-08 07:31:33 INFO epoch 0032/200: lr: 0.0000100: loss=14.264954 val_acc=0.6833885 val_loss=18.5185299
2025-09-08 07:31:36 INFO epoch 0033/200: lr: 0.0000100: loss=14.153733 val_acc=0.6829153 val_loss=18.4908218
2025-09-08 07:31:39 INFO epoch 0034/200: lr: 0.0000100: loss=14.047371 val_acc=0.6831519 val_loss=18.4532146
2025-09-08 07:31:42 INFO epoch 0035/200: lr: 0.0000100: loss=13.944386 val_acc=0.6841773 val_loss=18.3775673
2025-09-08 07:31:45 INFO epoch 0036/200: lr: 0.0000100: loss=13.844800 val_acc=0.6840196 val_loss=18.3261490
2025-09-08 07:31:49 INFO epoch 0037/200: lr: 0.0000100: loss=13.748498 val_acc=0.6846506 val_loss=18.2942924
2025-09-08 07:31:52 INFO epoch 0038/200: lr: 0.0000100: loss=13.654829 val_acc=0.6866225 val_loss=18.2454815
2025-09-08 07:31:55 INFO epoch 0039/200: lr: 0.0000100: loss=13.564986 val_acc=0.6871746 val_loss=18.2041130
2025-09-08 07:31:58 INFO epoch 0040/200: lr: 0.0000100: loss=13.478572 val_acc=0.6855182 val_loss=18.2265854
2025-09-08 07:32:02 INFO epoch 0041/200: lr: 0.0000100: loss=13.394022 val_acc=0.6889888 val_loss=18.2029552
2025-09-08 07:32:05 INFO epoch 0042/200: lr: 0.0000100: loss=13.312563 val_acc=0.6886733 val_loss=18.1557407
2025-09-08 07:32:08 INFO epoch 0043/200: lr: 0.0000100: loss=13.233382 val_acc=0.6888310 val_loss=18.1250916
2025-09-08 07:32:11 INFO epoch 0044/200: lr: 0.0000100: loss=13.155891 val_acc=0.6908818 val_loss=18.0802593
2025-09-08 07:32:15 INFO epoch 0045/200: lr: 0.0000100: loss=13.080937 val_acc=0.6899353 val_loss=18.0767517
2025-09-08 07:32:18 INFO epoch 0046/200: lr: 0.0000100: loss=13.008575 val_acc=0.6915129 val_loss=18.0409832
2025-09-08 07:32:21 INFO epoch 0047/200: lr: 0.0000100: loss=12.937540 val_acc=0.6915917 val_loss=18.0370827
2025-09-08 07:32:24 INFO epoch 0048/200: lr: 0.0000100: loss=12.868111 val_acc=0.6910396 val_loss=17.9915047
2025-09-08 07:32:27 INFO epoch 0049/200: lr: 0.0000100: loss=12.800543 val_acc=0.6911185 val_loss=17.9814606
2025-09-08 07:32:31 INFO epoch 0050/200: lr: 0.0000100: loss=12.734512 val_acc=0.6919861 val_loss=17.9655457
2025-09-08 07:32:34 INFO epoch 0051/200: lr: 0.0000100: loss=12.670302 val_acc=0.6935637 val_loss=17.9257259
2025-09-08 07:32:37 INFO epoch 0052/200: lr: 0.0000100: loss=12.607669 val_acc=0.6923805 val_loss=17.9299068
2025-09-08 07:32:40 INFO epoch 0053/200: lr: 0.0000100: loss=12.546670 val_acc=0.6934059 val_loss=17.8912239
2025-09-08 07:32:43 INFO epoch 0054/200: lr: 0.0000100: loss=12.486872 val_acc=0.6936425 val_loss=17.8874531
2025-09-08 07:32:47 INFO epoch 0055/200: lr: 0.0000100: loss=12.429047 val_acc=0.6945891 val_loss=17.8673840
2025-09-08 07:32:50 INFO epoch 0056/200: lr: 0.0000100: loss=12.372049 val_acc=0.6949046 val_loss=17.8299599
2025-09-08 07:32:53 INFO epoch 0057/200: lr: 0.0000100: loss=12.317063 val_acc=0.6956933 val_loss=17.7991199
2025-09-08 07:32:56 INFO epoch 0058/200: lr: 0.0000100: loss=12.263177 val_acc=0.6956145 val_loss=17.7921829
2025-09-08 07:32:59 INFO epoch 0059/200: lr: 0.0000100: loss=12.210453 val_acc=0.6950623 val_loss=17.7779808
2025-09-08 07:33:03 INFO epoch 0060/200: lr: 0.0000100: loss=12.159078 val_acc=0.6954567 val_loss=17.7983074
2025-09-08 07:33:06 INFO epoch 0061/200: lr: 0.0000100: loss=12.108465 val_acc=0.6956145 val_loss=17.7915077
2025-09-08 07:33:09 INFO epoch 0062/200: lr: 0.0000100: loss=12.059046 val_acc=0.6968765 val_loss=17.7615891
2025-09-08 07:33:12 INFO epoch 0063/200: lr: 0.0000100: loss=12.011117 val_acc=0.6960088 val_loss=17.7546482
2025-09-08 07:33:16 INFO epoch 0064/200: lr: 0.0000100: loss=11.963900 val_acc=0.6968765 val_loss=17.7347202
2025-09-08 07:33:19 INFO epoch 0065/200: lr: 0.0000100: loss=11.917836 val_acc=0.6969554 val_loss=17.7376633
2025-09-08 07:33:22 INFO epoch 0066/200: lr: 0.0000100: loss=11.872107 val_acc=0.6971920 val_loss=17.7068768
2025-09-08 07:33:25 INFO epoch 0067/200: lr: 0.0000100: loss=11.827185 val_acc=0.6988484 val_loss=17.6751137
2025-09-08 07:33:28 INFO epoch 0068/200: lr: 0.0000100: loss=11.783391 val_acc=0.6984540 val_loss=17.6818542
2025-09-08 07:33:31 INFO epoch 0069/200: lr: 0.0000100: loss=11.740047 val_acc=0.6994794 val_loss=17.6550884
2025-09-08 07:33:34 INFO epoch 0070/200: lr: 0.0000100: loss=11.697698 val_acc=0.6981385 val_loss=17.6675396
2025-09-08 07:33:38 INFO epoch 0071/200: lr: 0.0000100: loss=11.656111 val_acc=0.6997160 val_loss=17.6450253
2025-09-08 07:33:41 INFO epoch 0072/200: lr: 0.0000100: loss=11.615415 val_acc=0.7001104 val_loss=17.6390266
2025-09-08 07:33:44 INFO epoch 0073/200: lr: 0.0000100: loss=11.575251 val_acc=0.7011358 val_loss=17.6221600
2025-09-08 07:33:47 INFO epoch 0074/200: lr: 0.0000100: loss=11.535909 val_acc=0.6990850 val_loss=17.6301193
2025-09-08 07:33:51 INFO epoch 0075/200: lr: 0.0000100: loss=11.497330 val_acc=0.7001893 val_loss=17.6216583
2025-09-08 07:33:54 INFO epoch 0076/200: lr: 0.0000100: loss=11.459988 val_acc=0.7007414 val_loss=17.6219845
2025-09-08 07:33:57 INFO epoch 0077/200: lr: 0.0000100: loss=11.422823 val_acc=0.7012936 val_loss=17.5809574
2025-09-08 07:34:00 INFO epoch 0078/200: lr: 0.0000100: loss=11.386497 val_acc=0.7020035 val_loss=17.5853539
2025-09-08 07:34:03 INFO epoch 0079/200: lr: 0.0000100: loss=11.350380 val_acc=0.7018457 val_loss=17.5634174
2025-09-08 07:34:06 INFO epoch 0080/200: lr: 0.0000100: loss=11.314824 val_acc=0.7027134 val_loss=17.5522118
2025-09-08 07:34:10 INFO epoch 0081/200: lr: 0.0000100: loss=11.280111 val_acc=0.7024767 val_loss=17.5425282
2025-09-08 07:34:13 INFO epoch 0082/200: lr: 0.0000100: loss=11.246010 val_acc=0.7008203 val_loss=17.5767879
2025-09-08 07:34:16 INFO epoch 0083/200: lr: 0.0000100: loss=11.211887 val_acc=0.7028711 val_loss=17.5099030
2025-09-08 07:34:19 INFO epoch 0084/200: lr: 0.0000100: loss=11.179056 val_acc=0.7019246 val_loss=17.4974594
2025-09-08 07:34:22 INFO epoch 0085/200: lr: 0.0000100: loss=11.146596 val_acc=0.7018457 val_loss=17.5581989
2025-09-08 07:34:25 INFO epoch 0086/200: lr: 0.0000100: loss=11.114449 val_acc=0.7023979 val_loss=17.5391331
2025-09-08 07:34:28 INFO epoch 0087/200: lr: 0.0000100: loss=11.082810 val_acc=0.7034233 val_loss=17.5031052
2025-09-08 07:34:32 INFO epoch 0088/200: lr: 0.0000100: loss=11.051632 val_acc=0.7032655 val_loss=17.5172672
2025-09-08 07:34:35 INFO epoch 0089/200: lr: 0.0000100: loss=11.020889 val_acc=0.7039754 val_loss=17.4921284
2025-09-08 07:34:38 INFO epoch 0090/200: lr: 0.0000100: loss=10.990797 val_acc=0.7043698 val_loss=17.4787350
2025-09-08 07:34:42 INFO epoch 0091/200: lr: 0.0000100: loss=10.961064 val_acc=0.7042909 val_loss=17.5233364
2025-09-08 07:34:45 INFO epoch 0092/200: lr: 0.0000100: loss=10.931841 val_acc=0.7057107 val_loss=17.4776745
2025-09-08 07:34:48 INFO epoch 0093/200: lr: 0.0000100: loss=10.902780 val_acc=0.7053163 val_loss=17.4548206
2025-09-08 07:34:51 INFO epoch 0094/200: lr: 0.0000100: loss=10.874156 val_acc=0.7043698 val_loss=17.4959106
2025-09-08 07:34:54 INFO epoch 0095/200: lr: 0.0000100: loss=10.846396 val_acc=0.7064994 val_loss=17.4548740
2025-09-08 07:34:57 INFO epoch 0096/200: lr: 0.0000100: loss=10.818965 val_acc=0.7055529 val_loss=17.4634933
2025-09-08 07:35:01 INFO epoch 0097/200: lr: 0.0000100: loss=10.792103 val_acc=0.7053952 val_loss=17.4493313
2025-09-08 07:35:04 INFO epoch 0098/200: lr: 0.0000100: loss=10.765358 val_acc=0.7051585 val_loss=17.4524841
2025-09-08 07:35:07 INFO epoch 0099/200: lr: 0.0000100: loss=10.738962 val_acc=0.7057107 val_loss=17.4544392
2025-09-08 07:35:10 INFO epoch 0100/200: lr: 0.0000100: loss=10.713078 val_acc=0.7047642 val_loss=17.4415607
2025-09-08 07:35:13 INFO epoch 0101/200: lr: 0.0000100: loss=10.687579 val_acc=0.7054740 val_loss=17.4450626
2025-09-08 07:35:17 INFO epoch 0102/200: lr: 0.0000100: loss=10.662288 val_acc=0.7055529 val_loss=17.4326019
2025-09-08 07:35:20 INFO epoch 0103/200: lr: 0.0000100: loss=10.637757 val_acc=0.7051585 val_loss=17.4517956
2025-09-08 07:35:23 INFO epoch 0104/200: lr: 0.0000100: loss=10.612828 val_acc=0.7061051 val_loss=17.4490128
2025-09-08 07:35:26 INFO epoch 0105/200: lr: 0.0000100: loss=10.588329 val_acc=0.7060262 val_loss=17.4162216
2025-09-08 07:35:29 INFO epoch 0106/200: lr: 0.0000100: loss=10.564637 val_acc=0.7057107 val_loss=17.4547958
2025-09-08 07:35:32 INFO epoch 0107/200: lr: 0.0000100: loss=10.540894 val_acc=0.7061051 val_loss=17.4119797
2025-09-08 07:35:36 INFO epoch 0108/200: lr: 0.0000100: loss=10.517504 val_acc=0.7063417 val_loss=17.4112816
2025-09-08 07:35:39 INFO epoch 0109/200: lr: 0.0000100: loss=10.494174 val_acc=0.7042909 val_loss=17.4515991
2025-09-08 07:35:42 INFO epoch 0110/200: lr: 0.0000100: loss=10.471420 val_acc=0.7064206 val_loss=17.4102993
2025-09-08 07:35:45 INFO epoch 0111/200: lr: 0.0000100: loss=10.449147 val_acc=0.7064994 val_loss=17.4208450
2025-09-08 07:35:48 INFO epoch 0112/200: lr: 0.0000100: loss=10.426474 val_acc=0.7061051 val_loss=17.3987408
2025-09-08 07:35:51 INFO epoch 0113/200: lr: 0.0000100: loss=10.404675 val_acc=0.7069727 val_loss=17.4467411
2025-09-08 07:35:54 INFO epoch 0114/200: lr: 0.0000100: loss=10.382970 val_acc=0.7079981 val_loss=17.3991318
2025-09-08 07:35:58 INFO epoch 0115/200: lr: 0.0000100: loss=10.361317 val_acc=0.7063417 val_loss=17.4085617
2025-09-08 07:36:01 INFO epoch 0116/200: lr: 0.0000100: loss=10.340420 val_acc=0.7078404 val_loss=17.3522835
2025-09-08 07:36:04 INFO epoch 0117/200: lr: 0.0000100: loss=10.319230 val_acc=0.7064994 val_loss=17.3540802
2025-09-08 07:36:07 INFO epoch 0118/200: lr: 0.0000100: loss=10.298853 val_acc=0.7078404 val_loss=17.3694668
2025-09-08 07:36:11 INFO epoch 0119/200: lr: 0.0000100: loss=10.278190 val_acc=0.7079192 val_loss=17.3778172
2025-09-08 07:36:14 INFO epoch 0120/200: lr: 0.0000100: loss=10.257861 val_acc=0.7072882 val_loss=17.3780804
2025-09-08 07:36:17 INFO epoch 0121/200: lr: 0.0000100: loss=10.237833 val_acc=0.7073671 val_loss=17.3902969
2025-09-08 07:36:20 INFO epoch 0122/200: lr: 0.0000100: loss=10.218073 val_acc=0.7074460 val_loss=17.3605595
2025-09-08 07:36:23 INFO epoch 0123/200: lr: 0.0000100: loss=10.198293 val_acc=0.7075248 val_loss=17.3252678
2025-09-08 07:36:26 INFO epoch 0124/200: lr: 0.0000100: loss=10.179135 val_acc=0.7077615 val_loss=17.3506050
2025-09-08 07:36:30 INFO epoch 0125/200: lr: 0.0000100: loss=10.160058 val_acc=0.7066572 val_loss=17.3702946
2025-09-08 07:36:33 INFO epoch 0126/200: lr: 0.0000100: loss=10.141427 val_acc=0.7074460 val_loss=17.3481712
2025-09-08 07:36:36 INFO epoch 0127/200: lr: 0.0000100: loss=10.122554 val_acc=0.7072093 val_loss=17.3145008
2025-09-08 07:36:39 INFO epoch 0128/200: lr: 0.0000100: loss=10.104209 val_acc=0.7062628 val_loss=17.3549252
2025-09-08 07:36:42 INFO epoch 0129/200: lr: 0.0000100: loss=10.086105 val_acc=0.7089446 val_loss=17.3641262
2025-09-08 07:36:45 INFO epoch 0130/200: lr: 0.0000100: loss=10.067577 val_acc=0.7075248 val_loss=17.3380089
2025-09-08 07:36:49 INFO epoch 0131/200: lr: 0.0000100: loss=10.049921 val_acc=0.7087869 val_loss=17.3370705
2025-09-08 07:36:52 INFO epoch 0132/200: lr: 0.0000100: loss=10.032464 val_acc=0.7069727 val_loss=17.3451614
2025-09-08 07:36:55 INFO epoch 0133/200: lr: 0.0000100: loss=10.015289 val_acc=0.7076826 val_loss=17.3431110
2025-09-08 07:36:58 INFO epoch 0134/200: lr: 0.0000100: loss=9.998015 val_acc=0.7065783 val_loss=17.3336411
2025-09-08 07:37:02 INFO epoch 0135/200: lr: 0.0000100: loss=9.981347 val_acc=0.7081559 val_loss=17.3216400
2025-09-08 07:37:05 INFO epoch 0136/200: lr: 0.0000100: loss=9.964066 val_acc=0.7086291 val_loss=17.3192501
2025-09-08 07:37:08 INFO epoch 0137/200: lr: 0.0000100: loss=9.947760 val_acc=0.7072093 val_loss=17.3330727
2025-09-08 07:37:11 INFO epoch 0138/200: lr: 0.0000100: loss=9.930762 val_acc=0.7079981 val_loss=17.3406639
2025-09-08 07:37:14 INFO epoch 0139/200: lr: 0.0000100: loss=9.914657 val_acc=0.7078404 val_loss=17.3188934
2025-09-08 07:37:17 INFO epoch 0140/200: lr: 0.0000100: loss=9.898404 val_acc=0.7082347 val_loss=17.3173466
2025-09-08 07:37:21 INFO epoch 0141/200: lr: 0.0000100: loss=9.882148 val_acc=0.7072093 val_loss=17.3263683
2025-09-08 07:37:24 INFO epoch 0142/200: lr: 0.0000100: loss=9.866260 val_acc=0.7081559 val_loss=17.3273182
2025-09-08 07:37:27 INFO epoch 0143/200: lr: 0.0000100: loss=9.850879 val_acc=0.7063417 val_loss=17.3306637
2025-09-08 07:37:30 INFO epoch 0144/200: lr: 0.0000100: loss=9.834739 val_acc=0.7069727 val_loss=17.3438034
2025-09-08 07:37:33 INFO epoch 0145/200: lr: 0.0000100: loss=9.819395 val_acc=0.7094179 val_loss=17.3013096
2025-09-08 07:37:36 INFO epoch 0146/200: lr: 0.0000100: loss=9.803933 val_acc=0.7076037 val_loss=17.3433590
2025-09-08 07:37:40 INFO epoch 0147/200: lr: 0.0000100: loss=9.788789 val_acc=0.7086291 val_loss=17.3424702
2025-09-08 07:37:43 INFO epoch 0148/200: lr: 0.0000100: loss=9.773981 val_acc=0.7081559 val_loss=17.3414040
2025-09-08 07:37:46 INFO epoch 0149/200: lr: 0.0000100: loss=9.758654 val_acc=0.7087080 val_loss=17.2856236
2025-09-08 07:37:49 INFO epoch 0150/200: lr: 0.0000100: loss=9.744185 val_acc=0.7078404 val_loss=17.3104954
2025-09-08 07:37:53 INFO epoch 0151/200: lr: 0.0000100: loss=9.729515 val_acc=0.7069727 val_loss=17.3050632
2025-09-08 07:37:56 INFO epoch 0152/200: lr: 0.0000100: loss=9.714850 val_acc=0.7071305 val_loss=17.3193436
2025-09-08 07:37:59 INFO epoch 0153/200: lr: 0.0000100: loss=9.700391 val_acc=0.7072093 val_loss=17.3260021
2025-09-08 07:38:02 INFO epoch 0154/200: lr: 0.0000100: loss=9.686491 val_acc=0.7077615 val_loss=17.3241711
2025-09-08 07:38:06 INFO epoch 0155/200: lr: 0.0000100: loss=9.672495 val_acc=0.7077615 val_loss=17.3041935
2025-09-08 07:38:09 INFO epoch 0156/200: lr: 0.0000100: loss=9.658108 val_acc=0.7086291 val_loss=17.2873020
2025-09-08 07:38:12 INFO epoch 0157/200: lr: 0.0000100: loss=9.644676 val_acc=0.7072882 val_loss=17.3051548
2025-09-08 07:38:15 INFO epoch 0158/200: lr: 0.0000100: loss=9.630875 val_acc=0.7067361 val_loss=17.3240814
2025-09-08 07:38:18 INFO epoch 0159/200: lr: 0.0000100: loss=9.617336 val_acc=0.7057107 val_loss=17.3018837
2025-09-08 07:38:22 INFO epoch 0160/200: lr: 0.0000100: loss=9.604331 val_acc=0.7072093 val_loss=17.2993374
2025-09-08 07:38:25 INFO epoch 0161/200: lr: 0.0000100: loss=9.590951 val_acc=0.7074460 val_loss=17.3179474
2025-09-08 07:38:28 INFO epoch 0162/200: lr: 0.0000100: loss=9.577561 val_acc=0.7069727 val_loss=17.2859135
2025-09-08 07:38:31 INFO epoch 0163/200: lr: 0.0000100: loss=9.564674 val_acc=0.7065783 val_loss=17.2826462
2025-09-08 07:38:35 INFO epoch 0164/200: lr: 0.0000100: loss=9.552032 val_acc=0.7073671 val_loss=17.3153744
2025-09-08 07:38:38 INFO epoch 0165/200: lr: 0.0000100: loss=9.538889 val_acc=0.7059473 val_loss=17.3228436
2025-09-08 07:38:38 INFO Training complete in 8m 46s
2025-09-08 07:38:38 INFO Best val_acc@145 = 0.7094178892569806
2025-09-08 07:38:38 INFO Best val_loss@145 = 17.30130958557129
2025-09-08 07:38:38 INFO  stats|test: mean=-0.0014, std=0.9473
2025-09-08 07:38:38 INFO Linear evaluation: default_0_2025-09-05_16-17-52-checkpoint_last_nsynth_8b5f851e nsynth -> 0.70947
{'audio_repr': 'ar_eat.AR_EAT', 'weight_file': '/opt/gpfs/home/chushu/exp/eat/pre_4_AS2M/default_0_2025-09-05_16-17-52/checkpoint_last.pt', 'feature_d': 768, 'sample_rate': 16000, 'target_length': 1024, 'framework': 'fairseq', 'mode': 'finetune', 'prediction_mode': 'CLS_TOKEN', 'model_dir': '/opt/gpfs/home/chushu/codes/2506/EAT/EAT', 'batch_size': 64, 'lr_lineareval': 3e-05, 'report_per_epochs': 50, 'early_stop_epochs': 20, 'training_mask': 0.0, 'warmup_epochs': 5, 'mixup': 0.5, 'ft_bs': 128, 'ft_lr': 2.0, 'ft_early_stop_epochs': -1, 'ft_epochs': 200, 'ft_freq_mask': 30, 'ft_time_mask': 192, 'ft_noise': 0.0, 'ft_rrc': True, 'name': '', 'task_metadata': '/opt/gpfs/home/chushu/codes/2506/EAT/evar/evar/metadata/nsynth.csv', 'task_data': '/opt/gpfs/data/raw_data/nsynth/16k', 'unit_samples': 64000, 'id': 'default_0_2025-09-05_16-17-52-checkpoint_last_nsynth_81719882', 'task_name': 'nsynth', 'return_filename': False, 'mean': None, 'std': None, 'runtime_cfg': {'lr': 1e-05, 'seed': 43, 'hidden': (), 'standard_scaler': True, 'mixup': False, 'epochs': 200, 'early_stop_epochs': 20, 'id': '7d7f1d32'}}
/opt/gpfs/home/chushu/codes/2506/EAT/evar/logs/default_0_2025-09-05_16-17-52-checkpoint_last_nsynth_81719882/default-0-2025-09-05-16-17-52-checkpoint-last-nsynth-LE_8b5f851e_0.70947.csv
2025-09-08 07:38:38 INFO  -> /opt/gpfs/home/chushu/codes/2506/EAT/evar/results/scores.csv
2025-09-08 07:38:44 INFO {'audio_repr': 'ar_eat.AR_EAT', 'weight_file': '/opt/gpfs/home/chushu/exp/eat/pre_4_AS2M/default_0_2025-09-05_16-17-52/checkpoint_last.pt', 'feature_d': 768, 'sample_rate': 16000, 'target_length': 1024, 'framework': 'fairseq', 'mode': 'finetune', 'prediction_mode': 'CLS_TOKEN', 'model_dir': '/opt/gpfs/home/chushu/codes/2506/EAT/EAT', 'batch_size': 64, 'lr_lineareval': 3e-05, 'report_per_epochs': 50, 'early_stop_epochs': 20, 'training_mask': 0.0, 'warmup_epochs': 5, 'mixup': 0.5, 'ft_bs': 128, 'ft_lr': 2.0, 'ft_early_stop_epochs': -1, 'ft_epochs': 200, 'ft_freq_mask': 30, 'ft_time_mask': 192, 'ft_noise': 0.0, 'ft_rrc': True, 'name': '', 'task_metadata': '/opt/gpfs/home/chushu/codes/2506/EAT/evar/evar/metadata/nsynth.csv', 'task_data': '/opt/gpfs/data/raw_data/nsynth/16k', 'unit_samples': 64000, 'id': 'default_0_2025-09-05_16-17-52-checkpoint_last_nsynth_81719882', 'task_name': 'nsynth', 'return_filename': False, 'mean': None, 'std': None, 'runtime_cfg': {'lr': 1e-05, 'seed': 44, 'hidden': (), 'standard_scaler': True, 'mixup': False, 'epochs': 200, 'early_stop_epochs': 20, 'id': 'cb151996'}}
2025-09-08 07:38:45 INFO  classes: ['bass', 'brass', 'flute', 'guitar', 'keyboard', 'mallet', 'organ', 'reed', 'string', 'synth_lead', 'vocal']
2025-09-08 07:38:45 INFO Train:289205, valid:12678, test:4096, multi label:False
2025-09-08 07:38:45 INFO  using cached embeddings: embs-default_0_2025-09-05_16-17-52-checkpoint_last_nsynth_81719882-train-1
2025-09-08 07:38:45 INFO  using cached embeddings: embs-default_0_2025-09-05_16-17-52-checkpoint_last_nsynth_81719882-valid-1
2025-09-08 07:38:45 INFO  using cached embeddings: embs-default_0_2025-09-05_16-17-52-checkpoint_last_nsynth_81719882-test-1
2025-09-08 07:38:45 INFO 🚀 Started Linear evaluation:
2025-09-08 07:38:47 INFO  stats|train: mean=0.0000, std=1.0000
2025-09-08 07:38:47 INFO  stats|valid: mean=-0.0014, std=0.9460
2025-09-08 07:38:47 INFO Training model: MLP(
  (mlp): Sequential(
    (0): Linear(in_features=768, out_features=11, bias=True)
  )
)
2025-09-08 07:38:47 INFO Details - metric: acc, loss: <function loss_nll_with_logits at 0x7f9505cb09d0>, optimizer: Adam (
Parameter Group 0
    amsgrad: False
    betas: (0.9, 0.999)
    capturable: False
    decoupled_weight_decay: False
    differentiable: False
    eps: 1e-08
    foreach: None
    fused: None
    lr: 1e-05
    maximize: False
    weight_decay: 1e-08
), n_class: 11
2025-09-08 07:38:51 INFO epoch 0001/200: lr: 0.0000100: loss=37.566653 val_acc=0.4352422 val_loss=31.6420784
2025-09-08 07:38:54 INFO epoch 0002/200: lr: 0.0000100: loss=29.717631 val_acc=0.5048904 val_loss=27.4394779
2025-09-08 07:38:58 INFO epoch 0003/200: lr: 0.0000100: loss=26.442558 val_acc=0.5463796 val_loss=25.2267590
2025-09-08 07:39:01 INFO epoch 0004/200: lr: 0.0000100: loss=24.385990 val_acc=0.5715413 val_loss=23.8586159
2025-09-08 07:39:04 INFO epoch 0005/200: lr: 0.0000100: loss=22.915537 val_acc=0.5958353 val_loss=22.8542404
2025-09-08 07:39:07 INFO epoch 0006/200: lr: 0.0000100: loss=21.800686 val_acc=0.6112163 val_loss=22.1284466
2025-09-08 07:39:10 INFO epoch 0007/200: lr: 0.0000100: loss=20.916066 val_acc=0.6206026 val_loss=21.5558109
2025-09-08 07:39:14 INFO epoch 0008/200: lr: 0.0000100: loss=20.192242 val_acc=0.6286481 val_loss=21.1010399
2025-09-08 07:39:17 INFO epoch 0009/200: lr: 0.0000100: loss=19.585416 val_acc=0.6365357 val_loss=20.7677135
2025-09-08 07:39:20 INFO epoch 0010/200: lr: 0.0000100: loss=19.064155 val_acc=0.6447389 val_loss=20.4280739
2025-09-08 07:39:24 INFO epoch 0011/200: lr: 0.0000100: loss=18.608888 val_acc=0.6501814 val_loss=20.1753139
2025-09-08 07:39:27 INFO epoch 0012/200: lr: 0.0000100: loss=18.207846 val_acc=0.6525477 val_loss=20.0098362
2025-09-08 07:39:30 INFO epoch 0013/200: lr: 0.0000100: loss=17.848528 val_acc=0.6575170 val_loss=19.7962723
2025-09-08 07:39:33 INFO epoch 0014/200: lr: 0.0000100: loss=17.523639 val_acc=0.6602776 val_loss=19.6330948
2025-09-08 07:39:37 INFO epoch 0015/200: lr: 0.0000100: loss=17.225405 val_acc=0.6634327 val_loss=19.4657097
2025-09-08 07:39:40 INFO epoch 0016/200: lr: 0.0000100: loss=16.950269 val_acc=0.6665878 val_loss=19.3555126
2025-09-08 07:39:43 INFO epoch 0017/200: lr: 0.0000100: loss=16.694858 val_acc=0.6688752 val_loss=19.2264423
2025-09-08 07:39:46 INFO epoch 0018/200: lr: 0.0000100: loss=16.458141 val_acc=0.6699795 val_loss=19.1314907
2025-09-08 07:39:50 INFO epoch 0019/200: lr: 0.0000100: loss=16.237216 val_acc=0.6728979 val_loss=19.0336494
2025-09-08 07:39:53 INFO epoch 0020/200: lr: 0.0000100: loss=16.030043 val_acc=0.6747121 val_loss=18.9270210
2025-09-08 07:39:56 INFO epoch 0021/200: lr: 0.0000100: loss=15.834944 val_acc=0.6756586 val_loss=18.8779373
2025-09-08 07:39:59 INFO epoch 0022/200: lr: 0.0000100: loss=15.651114 val_acc=0.6758164 val_loss=18.8119984
2025-09-08 07:40:03 INFO epoch 0023/200: lr: 0.0000100: loss=15.478496 val_acc=0.6766051 val_loss=18.7356434
2025-09-08 07:40:06 INFO epoch 0024/200: lr: 0.0000100: loss=15.315026 val_acc=0.6778672 val_loss=18.6109028
2025-09-08 07:40:09 INFO epoch 0025/200: lr: 0.0000100: loss=15.158850 val_acc=0.6792081 val_loss=18.5826607
2025-09-08 07:40:13 INFO epoch 0026/200: lr: 0.0000100: loss=15.010170 val_acc=0.6815744 val_loss=18.5231380
2025-09-08 07:40:16 INFO epoch 0027/200: lr: 0.0000100: loss=14.867459 val_acc=0.6818899 val_loss=18.4681854
2025-09-08 07:40:19 INFO epoch 0028/200: lr: 0.0000100: loss=14.731305 val_acc=0.6815744 val_loss=18.4687366
2025-09-08 07:40:22 INFO epoch 0029/200: lr: 0.0000100: loss=14.600616 val_acc=0.6844139 val_loss=18.3957996
2025-09-08 07:40:26 INFO epoch 0030/200: lr: 0.0000100: loss=14.476549 val_acc=0.6847295 val_loss=18.3410835
2025-09-08 07:40:29 INFO epoch 0031/200: lr: 0.0000100: loss=14.357969 val_acc=0.6859915 val_loss=18.2966938
2025-09-08 07:40:32 INFO epoch 0032/200: lr: 0.0000100: loss=14.243534 val_acc=0.6862281 val_loss=18.2374897
2025-09-08 07:40:35 INFO epoch 0033/200: lr: 0.0000100: loss=14.134022 val_acc=0.6873324 val_loss=18.2076988
2025-09-08 07:40:38 INFO epoch 0034/200: lr: 0.0000100: loss=14.028313 val_acc=0.6876479 val_loss=18.1767826
2025-09-08 07:40:42 INFO epoch 0035/200: lr: 0.0000100: loss=13.924943 val_acc=0.6870169 val_loss=18.1360016
2025-09-08 07:40:45 INFO epoch 0036/200: lr: 0.0000100: loss=13.826179 val_acc=0.6872535 val_loss=18.1008949
2025-09-08 07:40:48 INFO epoch 0037/200: lr: 0.0000100: loss=13.730343 val_acc=0.6880423 val_loss=18.0862503
2025-09-08 07:40:51 INFO epoch 0038/200: lr: 0.0000100: loss=13.637904 val_acc=0.6885944 val_loss=18.0519733
2025-09-08 07:40:54 INFO epoch 0039/200: lr: 0.0000100: loss=13.548333 val_acc=0.6873324 val_loss=18.0378590
2025-09-08 07:40:58 INFO epoch 0040/200: lr: 0.0000100: loss=13.461314 val_acc=0.6888310 val_loss=18.0125866
2025-09-08 07:41:01 INFO epoch 0041/200: lr: 0.0000100: loss=13.377592 val_acc=0.6898564 val_loss=17.9556675
2025-09-08 07:41:04 INFO epoch 0042/200: lr: 0.0000100: loss=13.296720 val_acc=0.6891466 val_loss=17.9497700
2025-09-08 07:41:07 INFO epoch 0043/200: lr: 0.0000100: loss=13.217552 val_acc=0.6907241 val_loss=17.9116096
2025-09-08 07:41:11 INFO epoch 0044/200: lr: 0.0000100: loss=13.140410 val_acc=0.6909607 val_loss=17.9105091
2025-09-08 07:41:14 INFO epoch 0045/200: lr: 0.0000100: loss=13.065511 val_acc=0.6914340 val_loss=17.8657703
2025-09-08 07:41:17 INFO epoch 0046/200: lr: 0.0000100: loss=12.993940 val_acc=0.6913551 val_loss=17.8399391
2025-09-08 07:41:21 INFO epoch 0047/200: lr: 0.0000100: loss=12.924308 val_acc=0.6924594 val_loss=17.8126621
2025-09-08 07:41:24 INFO epoch 0048/200: lr: 0.0000100: loss=12.856019 val_acc=0.6941947 val_loss=17.7686996
2025-09-08 07:41:27 INFO epoch 0049/200: lr: 0.0000100: loss=12.790062 val_acc=0.6915129 val_loss=17.7707920
2025-09-08 07:41:30 INFO epoch 0050/200: lr: 0.0000100: loss=12.725136 val_acc=0.6927749 val_loss=17.7619457
2025-09-08 07:41:34 INFO epoch 0051/200: lr: 0.0000100: loss=12.660704 val_acc=0.6926960 val_loss=17.7475147
2025-09-08 07:41:37 INFO epoch 0052/200: lr: 0.0000100: loss=12.599058 val_acc=0.6941947 val_loss=17.7100086
2025-09-08 07:41:40 INFO epoch 0053/200: lr: 0.0000100: loss=12.538480 val_acc=0.6941158 val_loss=17.7058887
2025-09-08 07:41:44 INFO epoch 0054/200: lr: 0.0000100: loss=12.479169 val_acc=0.6941947 val_loss=17.6971951
2025-09-08 07:41:47 INFO epoch 0055/200: lr: 0.0000100: loss=12.421480 val_acc=0.6946679 val_loss=17.6555462
2025-09-08 07:41:50 INFO epoch 0056/200: lr: 0.0000100: loss=12.364671 val_acc=0.6950623 val_loss=17.6625099
2025-09-08 07:41:53 INFO epoch 0057/200: lr: 0.0000100: loss=12.309822 val_acc=0.6952201 val_loss=17.5966606
2025-09-08 07:41:56 INFO epoch 0058/200: lr: 0.0000100: loss=12.255567 val_acc=0.6953778 val_loss=17.6377697
2025-09-08 07:41:59 INFO epoch 0059/200: lr: 0.0000100: loss=12.203093 val_acc=0.6955356 val_loss=17.6256962
2025-09-08 07:42:03 INFO epoch 0060/200: lr: 0.0000100: loss=12.151775 val_acc=0.6947468 val_loss=17.5922565
2025-09-08 07:42:06 INFO epoch 0061/200: lr: 0.0000100: loss=12.101393 val_acc=0.6953778 val_loss=17.5771503
2025-09-08 07:42:09 INFO epoch 0062/200: lr: 0.0000100: loss=12.052047 val_acc=0.6971131 val_loss=17.5709610
2025-09-08 07:42:12 INFO epoch 0063/200: lr: 0.0000100: loss=12.003784 val_acc=0.6968765 val_loss=17.5378113
2025-09-08 07:42:15 INFO epoch 0064/200: lr: 0.0000100: loss=11.956129 val_acc=0.6970342 val_loss=17.4768047
2025-09-08 07:42:19 INFO epoch 0065/200: lr: 0.0000100: loss=11.909702 val_acc=0.6975075 val_loss=17.5251980
2025-09-08 07:42:22 INFO epoch 0066/200: lr: 0.0000100: loss=11.864043 val_acc=0.6971131 val_loss=17.5529118
2025-09-08 07:42:25 INFO epoch 0067/200: lr: 0.0000100: loss=11.819332 val_acc=0.6977441 val_loss=17.5091839
2025-09-08 07:42:28 INFO epoch 0068/200: lr: 0.0000100: loss=11.775523 val_acc=0.6982174 val_loss=17.4675007
2025-09-08 07:42:31 INFO epoch 0069/200: lr: 0.0000100: loss=11.732472 val_acc=0.6975864 val_loss=17.4713879
2025-09-08 07:42:34 INFO epoch 0070/200: lr: 0.0000100: loss=11.690946 val_acc=0.6979019 val_loss=17.4956207
2025-09-08 07:42:38 INFO epoch 0071/200: lr: 0.0000100: loss=11.649544 val_acc=0.6997949 val_loss=17.4617615
2025-09-08 07:42:41 INFO epoch 0072/200: lr: 0.0000100: loss=11.609192 val_acc=0.7001104 val_loss=17.4110966
2025-09-08 07:42:44 INFO epoch 0073/200: lr: 0.0000100: loss=11.570190 val_acc=0.6977441 val_loss=17.4648895
2025-09-08 07:42:47 INFO epoch 0074/200: lr: 0.0000100: loss=11.531297 val_acc=0.6997949 val_loss=17.4256001
2025-09-08 07:42:51 INFO epoch 0075/200: lr: 0.0000100: loss=11.492893 val_acc=0.6990062 val_loss=17.4388466
2025-09-08 07:42:54 INFO epoch 0076/200: lr: 0.0000100: loss=11.454696 val_acc=0.6992428 val_loss=17.4117794
2025-09-08 07:42:57 INFO epoch 0077/200: lr: 0.0000100: loss=11.417322 val_acc=0.7013725 val_loss=17.4112549
2025-09-08 07:43:00 INFO epoch 0078/200: lr: 0.0000100: loss=11.381005 val_acc=0.7001893 val_loss=17.4003124
2025-09-08 07:43:03 INFO epoch 0079/200: lr: 0.0000100: loss=11.345103 val_acc=0.7004259 val_loss=17.3923817
2025-09-08 07:43:06 INFO epoch 0080/200: lr: 0.0000100: loss=11.309830 val_acc=0.7013725 val_loss=17.4024811
2025-09-08 07:43:10 INFO epoch 0081/200: lr: 0.0000100: loss=11.275432 val_acc=0.7008203 val_loss=17.3566666
2025-09-08 07:43:13 INFO epoch 0082/200: lr: 0.0000100: loss=11.241214 val_acc=0.6993217 val_loss=17.4134064
2025-09-08 07:43:16 INFO epoch 0083/200: lr: 0.0000100: loss=11.207704 val_acc=0.7023979 val_loss=17.3460884
2025-09-08 07:43:19 INFO epoch 0084/200: lr: 0.0000100: loss=11.175028 val_acc=0.7025556 val_loss=17.3239613
2025-09-08 07:43:23 INFO epoch 0085/200: lr: 0.0000100: loss=11.142979 val_acc=0.7031866 val_loss=17.3511677
2025-09-08 07:43:26 INFO epoch 0086/200: lr: 0.0000100: loss=11.111484 val_acc=0.7027922 val_loss=17.3426056
2025-09-08 07:43:29 INFO epoch 0087/200: lr: 0.0000100: loss=11.079956 val_acc=0.7033444 val_loss=17.3391113
2025-09-08 07:43:33 INFO epoch 0088/200: lr: 0.0000100: loss=11.048707 val_acc=0.7023190 val_loss=17.3316307
2025-09-08 07:43:36 INFO epoch 0089/200: lr: 0.0000100: loss=11.018922 val_acc=0.7029500 val_loss=17.3549690
2025-09-08 07:43:39 INFO epoch 0090/200: lr: 0.0000100: loss=10.988572 val_acc=0.7041331 val_loss=17.3154469
2025-09-08 07:43:42 INFO epoch 0091/200: lr: 0.0000100: loss=10.959172 val_acc=0.7034233 val_loss=17.3306007
2025-09-08 07:43:46 INFO epoch 0092/200: lr: 0.0000100: loss=10.929892 val_acc=0.7029500 val_loss=17.3402004
2025-09-08 07:43:49 INFO epoch 0093/200: lr: 0.0000100: loss=10.901239 val_acc=0.7035810 val_loss=17.3193417
2025-09-08 07:43:52 INFO epoch 0094/200: lr: 0.0000100: loss=10.872996 val_acc=0.7052374 val_loss=17.3001900
2025-09-08 07:43:56 INFO epoch 0095/200: lr: 0.0000100: loss=10.845091 val_acc=0.7059473 val_loss=17.2773247
2025-09-08 07:43:59 INFO epoch 0096/200: lr: 0.0000100: loss=10.817644 val_acc=0.7054740 val_loss=17.2770767
2025-09-08 07:44:02 INFO epoch 0097/200: lr: 0.0000100: loss=10.790683 val_acc=0.7050797 val_loss=17.2956791
2025-09-08 07:44:05 INFO epoch 0098/200: lr: 0.0000100: loss=10.764078 val_acc=0.7055529 val_loss=17.2816105
2025-09-08 07:44:08 INFO epoch 0099/200: lr: 0.0000100: loss=10.737826 val_acc=0.7075248 val_loss=17.2566204
2025-09-08 07:44:12 INFO epoch 0100/200: lr: 0.0000100: loss=10.711873 val_acc=0.7057107 val_loss=17.2508984
2025-09-08 07:44:15 INFO epoch 0101/200: lr: 0.0000100: loss=10.686504 val_acc=0.7064994 val_loss=17.2741661
2025-09-08 07:44:18 INFO epoch 0102/200: lr: 0.0000100: loss=10.660721 val_acc=0.7065783 val_loss=17.2770481
2025-09-08 07:44:21 INFO epoch 0103/200: lr: 0.0000100: loss=10.635941 val_acc=0.7057896 val_loss=17.2766895
2025-09-08 07:44:24 INFO epoch 0104/200: lr: 0.0000100: loss=10.611344 val_acc=0.7054740 val_loss=17.2465801
2025-09-08 07:44:27 INFO epoch 0105/200: lr: 0.0000100: loss=10.587085 val_acc=0.7061839 val_loss=17.2375355
2025-09-08 07:44:31 INFO epoch 0106/200: lr: 0.0000100: loss=10.562921 val_acc=0.7073671 val_loss=17.2489071
2025-09-08 07:44:34 INFO epoch 0107/200: lr: 0.0000100: loss=10.539442 val_acc=0.7079192 val_loss=17.2556477
2025-09-08 07:44:37 INFO epoch 0108/200: lr: 0.0000100: loss=10.516109 val_acc=0.7060262 val_loss=17.2233963
2025-09-08 07:44:40 INFO epoch 0109/200: lr: 0.0000100: loss=10.493178 val_acc=0.7086291 val_loss=17.2145138
2025-09-08 07:44:43 INFO epoch 0110/200: lr: 0.0000100: loss=10.470819 val_acc=0.7077615 val_loss=17.2202110
2025-09-08 07:44:47 INFO epoch 0111/200: lr: 0.0000100: loss=10.448652 val_acc=0.7076037 val_loss=17.2353230
2025-09-08 07:44:50 INFO epoch 0112/200: lr: 0.0000100: loss=10.426339 val_acc=0.7071305 val_loss=17.2443638
2025-09-08 07:44:53 INFO epoch 0113/200: lr: 0.0000100: loss=10.404612 val_acc=0.7065783 val_loss=17.2058678
2025-09-08 07:44:56 INFO epoch 0114/200: lr: 0.0000100: loss=10.383152 val_acc=0.7065783 val_loss=17.2279282
2025-09-08 07:45:00 INFO epoch 0115/200: lr: 0.0000100: loss=10.361644 val_acc=0.7069727 val_loss=17.2206402
2025-09-08 07:45:03 INFO epoch 0116/200: lr: 0.0000100: loss=10.340606 val_acc=0.7075248 val_loss=17.2170544
2025-09-08 07:45:06 INFO epoch 0117/200: lr: 0.0000100: loss=10.319608 val_acc=0.7077615 val_loss=17.1896572
2025-09-08 07:45:09 INFO epoch 0118/200: lr: 0.0000100: loss=10.299087 val_acc=0.7079192 val_loss=17.1757355
2025-09-08 07:45:13 INFO epoch 0119/200: lr: 0.0000100: loss=10.278575 val_acc=0.7076037 val_loss=17.2040176
2025-09-08 07:45:16 INFO epoch 0120/200: lr: 0.0000100: loss=10.258658 val_acc=0.7061839 val_loss=17.2072468
2025-09-08 07:45:19 INFO epoch 0121/200: lr: 0.0000100: loss=10.238518 val_acc=0.7077615 val_loss=17.1836224
2025-09-08 07:45:22 INFO epoch 0122/200: lr: 0.0000100: loss=10.218663 val_acc=0.7087080 val_loss=17.1873245
2025-09-08 07:45:26 INFO epoch 0123/200: lr: 0.0000100: loss=10.199402 val_acc=0.7072093 val_loss=17.2123775
2025-09-08 07:45:29 INFO epoch 0124/200: lr: 0.0000100: loss=10.179823 val_acc=0.7082347 val_loss=17.1802158
2025-09-08 07:45:32 INFO epoch 0125/200: lr: 0.0000100: loss=10.161646 val_acc=0.7079192 val_loss=17.1902008
2025-09-08 07:45:35 INFO epoch 0126/200: lr: 0.0000100: loss=10.142728 val_acc=0.7091813 val_loss=17.1750984
2025-09-08 07:45:38 INFO epoch 0127/200: lr: 0.0000100: loss=10.123956 val_acc=0.7073671 val_loss=17.1836967
2025-09-08 07:45:42 INFO epoch 0128/200: lr: 0.0000100: loss=10.105295 val_acc=0.7057896 val_loss=17.2056179
2025-09-08 07:45:45 INFO epoch 0129/200: lr: 0.0000100: loss=10.087323 val_acc=0.7089446 val_loss=17.1856785
2025-09-08 07:45:48 INFO epoch 0130/200: lr: 0.0000100: loss=10.069853 val_acc=0.7084714 val_loss=17.1812611
2025-09-08 07:45:51 INFO epoch 0131/200: lr: 0.0000100: loss=10.052283 val_acc=0.7088658 val_loss=17.1822357
2025-09-08 07:45:55 INFO epoch 0132/200: lr: 0.0000100: loss=10.035147 val_acc=0.7077615 val_loss=17.1708584
2025-09-08 07:45:58 INFO epoch 0133/200: lr: 0.0000100: loss=10.017965 val_acc=0.7076037 val_loss=17.2194080
2025-09-08 07:46:01 INFO epoch 0134/200: lr: 0.0000100: loss=10.000846 val_acc=0.7067361 val_loss=17.2159996
2025-09-08 07:46:05 INFO epoch 0135/200: lr: 0.0000100: loss=9.983543 val_acc=0.7077615 val_loss=17.1671028
2025-09-08 07:46:08 INFO epoch 0136/200: lr: 0.0000100: loss=9.966629 val_acc=0.7081559 val_loss=17.1950245
2025-09-08 07:46:11 INFO epoch 0137/200: lr: 0.0000100: loss=9.949973 val_acc=0.7083925 val_loss=17.1651268
2025-09-08 07:46:14 INFO epoch 0138/200: lr: 0.0000100: loss=9.933142 val_acc=0.7082347 val_loss=17.1657104
2025-09-08 07:46:17 INFO epoch 0139/200: lr: 0.0000100: loss=9.916687 val_acc=0.7074460 val_loss=17.1923504
2025-09-08 07:46:20 INFO epoch 0140/200: lr: 0.0000100: loss=9.900580 val_acc=0.7076037 val_loss=17.1644936
2025-09-08 07:46:24 INFO epoch 0141/200: lr: 0.0000100: loss=9.884438 val_acc=0.7072882 val_loss=17.1723862
2025-09-08 07:46:27 INFO epoch 0142/200: lr: 0.0000100: loss=9.868584 val_acc=0.7069727 val_loss=17.1569710
2025-09-08 07:46:30 INFO epoch 0143/200: lr: 0.0000100: loss=9.853017 val_acc=0.7083925 val_loss=17.1669064
2025-09-08 07:46:33 INFO epoch 0144/200: lr: 0.0000100: loss=9.837859 val_acc=0.7069727 val_loss=17.1823101
2025-09-08 07:46:36 INFO epoch 0145/200: lr: 0.0000100: loss=9.822176 val_acc=0.7087869 val_loss=17.1812897
2025-09-08 07:46:40 INFO epoch 0146/200: lr: 0.0000100: loss=9.806907 val_acc=0.7077615 val_loss=17.1747646
2025-09-08 07:46:40 INFO Training complete in 7m 52s
2025-09-08 07:46:40 INFO Best val_acc@126 = 0.7091812588736394
2025-09-08 07:46:40 INFO Best val_loss@126 = 17.175098419189453
2025-09-08 07:46:40 INFO  stats|test: mean=-0.0014, std=0.9473
2025-09-08 07:46:40 INFO Linear evaluation: default_0_2025-09-05_16-17-52-checkpoint_last_nsynth_17069150 nsynth -> 0.71045
{'audio_repr': 'ar_eat.AR_EAT', 'weight_file': '/opt/gpfs/home/chushu/exp/eat/pre_4_AS2M/default_0_2025-09-05_16-17-52/checkpoint_last.pt', 'feature_d': 768, 'sample_rate': 16000, 'target_length': 1024, 'framework': 'fairseq', 'mode': 'finetune', 'prediction_mode': 'CLS_TOKEN', 'model_dir': '/opt/gpfs/home/chushu/codes/2506/EAT/EAT', 'batch_size': 64, 'lr_lineareval': 3e-05, 'report_per_epochs': 50, 'early_stop_epochs': 20, 'training_mask': 0.0, 'warmup_epochs': 5, 'mixup': 0.5, 'ft_bs': 128, 'ft_lr': 2.0, 'ft_early_stop_epochs': -1, 'ft_epochs': 200, 'ft_freq_mask': 30, 'ft_time_mask': 192, 'ft_noise': 0.0, 'ft_rrc': True, 'name': '', 'task_metadata': '/opt/gpfs/home/chushu/codes/2506/EAT/evar/evar/metadata/nsynth.csv', 'task_data': '/opt/gpfs/data/raw_data/nsynth/16k', 'unit_samples': 64000, 'id': 'default_0_2025-09-05_16-17-52-checkpoint_last_nsynth_81719882', 'task_name': 'nsynth', 'return_filename': False, 'mean': None, 'std': None, 'runtime_cfg': {'lr': 1e-05, 'seed': 44, 'hidden': (), 'standard_scaler': True, 'mixup': False, 'epochs': 200, 'early_stop_epochs': 20, 'id': 'cb151996'}}
/opt/gpfs/home/chushu/codes/2506/EAT/evar/logs/default_0_2025-09-05_16-17-52-checkpoint_last_nsynth_81719882/default-0-2025-09-05-16-17-52-checkpoint-last-nsynth-LE_17069150_0.71045.csv
2025-09-08 07:46:40 INFO  -> /opt/gpfs/home/chushu/codes/2506/EAT/evar/results/scores.csv
