2025-09-08 06:43:01 INFO {'audio_repr': 'ar_eat.AR_EAT', 'weight_file': '/opt/gpfs/home/chushu/exp/eat/pre_4_AS2M/default_0_2025-09-05_16-17-52/checkpoint_last.pt', 'feature_d': 768, 'sample_rate': 16000, 'target_length': 1024, 'framework': 'fairseq', 'mode': 'finetune', 'prediction_mode': 'CLS_TOKEN', 'model_dir': '/opt/gpfs/home/chushu/codes/2506/EAT/EAT', 'batch_size': 16, 'lr_lineareval': 3e-05, 'report_per_epochs': 50, 'early_stop_epochs': 20, 'training_mask': 0.0, 'warmup_epochs': 5, 'mixup': 0.5, 'ft_bs': 128, 'ft_lr': 2.0, 'ft_early_stop_epochs': -1, 'ft_epochs': 200, 'ft_freq_mask': 30, 'ft_time_mask': 192, 'ft_noise': 0.0, 'ft_rrc': True, 'name': '', 'task_metadata': '/opt/gpfs/home/chushu/codes/2506/EAT/evar/evar/metadata/cremad.csv', 'task_data': '/opt/gpfs/data/raw_data/cremad/16k', 'unit_samples': 40000, 'id': 'default_0_2025-09-05_16-17-52-checkpoint_last_cremad_764ad5e5', 'task_name': 'cremad', 'return_filename': False, 'mean': None, 'std': None, 'runtime_cfg': {'lr': 1e-05, 'seed': 42, 'hidden': (), 'standard_scaler': True, 'mixup': False, 'epochs': 200, 'early_stop_epochs': 20, 'id': '50d291e1'}}
2025-09-08 06:43:01 INFO  classes: ['ANG', 'DIS', 'FEA', 'HAP', 'NEU', 'SAD']
2025-09-08 06:43:01 INFO Train:5155, valid:732, test:1551, multi label:False
2025-09-08 06:43:01 INFO  using cached embeddings: embs-default_0_2025-09-05_16-17-52-checkpoint_last_cremad_764ad5e5-train-1
2025-09-08 06:43:01 INFO  using cached embeddings: embs-default_0_2025-09-05_16-17-52-checkpoint_last_cremad_764ad5e5-valid-1
2025-09-08 06:43:01 INFO  using cached embeddings: embs-default_0_2025-09-05_16-17-52-checkpoint_last_cremad_764ad5e5-test-1
2025-09-08 06:43:06 INFO {'audio_repr': 'ar_eat.AR_EAT', 'weight_file': '/opt/gpfs/home/chushu/exp/eat/pre_4_AS2M/default_0_2025-09-05_16-17-52/checkpoint_last.pt', 'feature_d': 768, 'sample_rate': 16000, 'target_length': 1024, 'framework': 'fairseq', 'mode': 'finetune', 'prediction_mode': 'CLS_TOKEN', 'model_dir': '/opt/gpfs/home/chushu/codes/2506/EAT/EAT', 'batch_size': 16, 'lr_lineareval': 3e-05, 'report_per_epochs': 50, 'early_stop_epochs': 20, 'training_mask': 0.0, 'warmup_epochs': 5, 'mixup': 0.5, 'ft_bs': 128, 'ft_lr': 2.0, 'ft_early_stop_epochs': -1, 'ft_epochs': 200, 'ft_freq_mask': 30, 'ft_time_mask': 192, 'ft_noise': 0.0, 'ft_rrc': True, 'name': '', 'task_metadata': '/opt/gpfs/home/chushu/codes/2506/EAT/evar/evar/metadata/cremad.csv', 'task_data': '/opt/gpfs/data/raw_data/cremad/16k', 'unit_samples': 40000, 'id': 'default_0_2025-09-05_16-17-52-checkpoint_last_cremad_764ad5e5', 'task_name': 'cremad', 'return_filename': False, 'mean': None, 'std': None, 'runtime_cfg': {'lr': 1e-05, 'seed': 42, 'hidden': (), 'standard_scaler': True, 'mixup': False, 'epochs': 200, 'early_stop_epochs': 20, 'id': '50d291e1'}}
2025-09-08 06:43:06 INFO  classes: ['ANG', 'DIS', 'FEA', 'HAP', 'NEU', 'SAD']
2025-09-08 06:43:06 INFO Train:5155, valid:732, test:1551, multi label:False
2025-09-08 06:43:06 INFO  using cached embeddings: embs-default_0_2025-09-05_16-17-52-checkpoint_last_cremad_764ad5e5-train-1
2025-09-08 06:43:06 INFO  using cached embeddings: embs-default_0_2025-09-05_16-17-52-checkpoint_last_cremad_764ad5e5-valid-1
2025-09-08 06:43:06 INFO  using cached embeddings: embs-default_0_2025-09-05_16-17-52-checkpoint_last_cremad_764ad5e5-test-1
2025-09-08 06:43:06 INFO 🚀 Started Linear evaluation:
2025-09-08 06:43:06 INFO  stats|train: mean=0.0000, std=1.0000
2025-09-08 06:43:06 INFO  stats|valid: mean=-0.0012, std=1.0562
2025-09-08 06:43:07 INFO Training model: MLP(
  (mlp): Sequential(
    (0): Linear(in_features=768, out_features=6, bias=True)
  )
)
2025-09-08 06:43:07 INFO Details - metric: acc, loss: <function loss_nll_with_logits at 0x7fbec85f89d0>, optimizer: Adam (
Parameter Group 0
    amsgrad: False
    betas: (0.9, 0.999)
    capturable: False
    decoupled_weight_decay: False
    differentiable: False
    eps: 1e-08
    foreach: None
    fused: None
    lr: 1e-05
    maximize: False
    weight_decay: 1e-08
), n_class: 6
2025-09-08 06:43:07 INFO epoch 0001/200: lr: 0.0000100: loss=61.376065 val_acc=0.1871585 val_loss=57.2271233
2025-09-08 06:43:07 INFO epoch 0002/200: lr: 0.0000100: loss=60.792528 val_acc=0.1980874 val_loss=56.6565018
2025-09-08 06:43:07 INFO epoch 0003/200: lr: 0.0000100: loss=60.264376 val_acc=0.2021858 val_loss=56.1297913
2025-09-08 06:43:07 INFO epoch 0004/200: lr: 0.0000100: loss=59.775634 val_acc=0.2062842 val_loss=55.6578293
2025-09-08 06:43:07 INFO epoch 0005/200: lr: 0.0000100: loss=59.327214 val_acc=0.2172131 val_loss=55.2200699
2025-09-08 06:43:07 INFO epoch 0006/200: lr: 0.0000100: loss=58.904686 val_acc=0.2213115 val_loss=54.8158340
2025-09-08 06:43:07 INFO epoch 0007/200: lr: 0.0000100: loss=58.509253 val_acc=0.2281421 val_loss=54.4462128
2025-09-08 06:43:07 INFO epoch 0008/200: lr: 0.0000100: loss=58.136921 val_acc=0.2336066 val_loss=54.0974808
2025-09-08 06:43:07 INFO epoch 0009/200: lr: 0.0000100: loss=57.785340 val_acc=0.2459016 val_loss=53.7733536
2025-09-08 06:43:07 INFO epoch 0010/200: lr: 0.0000100: loss=57.451894 val_acc=0.2540984 val_loss=53.4657288
2025-09-08 06:43:08 INFO epoch 0011/200: lr: 0.0000100: loss=57.136140 val_acc=0.2554645 val_loss=53.1879807
2025-09-08 06:43:08 INFO epoch 0012/200: lr: 0.0000100: loss=56.836748 val_acc=0.2609290 val_loss=52.9196091
2025-09-08 06:43:08 INFO epoch 0013/200: lr: 0.0000100: loss=56.551151 val_acc=0.2650273 val_loss=52.6647453
2025-09-08 06:43:08 INFO epoch 0014/200: lr: 0.0000100: loss=56.277302 val_acc=0.2663934 val_loss=52.4314804
2025-09-08 06:43:08 INFO epoch 0015/200: lr: 0.0000100: loss=56.018492 val_acc=0.2773224 val_loss=52.2039452
2025-09-08 06:43:08 INFO epoch 0016/200: lr: 0.0000100: loss=55.768540 val_acc=0.2841530 val_loss=51.9907265
2025-09-08 06:43:08 INFO epoch 0017/200: lr: 0.0000100: loss=55.527791 val_acc=0.2909836 val_loss=51.7842789
2025-09-08 06:43:08 INFO epoch 0018/200: lr: 0.0000100: loss=55.294607 val_acc=0.2909836 val_loss=51.5952072
2025-09-08 06:43:08 INFO epoch 0019/200: lr: 0.0000100: loss=55.073801 val_acc=0.2991803 val_loss=51.4153709
2025-09-08 06:43:08 INFO epoch 0020/200: lr: 0.0000100: loss=54.859497 val_acc=0.2978142 val_loss=51.2315063
2025-09-08 06:43:08 INFO epoch 0021/200: lr: 0.0000100: loss=54.651836 val_acc=0.3019126 val_loss=51.0703049
2025-09-08 06:43:08 INFO epoch 0022/200: lr: 0.0000100: loss=54.454404 val_acc=0.3046448 val_loss=50.9006462
2025-09-08 06:43:08 INFO epoch 0023/200: lr: 0.0000100: loss=54.258599 val_acc=0.3114754 val_loss=50.7531586
2025-09-08 06:43:08 INFO epoch 0024/200: lr: 0.0000100: loss=54.072669 val_acc=0.3155738 val_loss=50.6038666
2025-09-08 06:43:08 INFO epoch 0025/200: lr: 0.0000100: loss=53.890945 val_acc=0.3265027 val_loss=50.4553223
2025-09-08 06:43:08 INFO epoch 0026/200: lr: 0.0000100: loss=53.716355 val_acc=0.3306011 val_loss=50.3166122
2025-09-08 06:43:09 INFO epoch 0027/200: lr: 0.0000100: loss=53.545077 val_acc=0.3333333 val_loss=50.1793823
2025-09-08 06:43:09 INFO epoch 0028/200: lr: 0.0000100: loss=53.378469 val_acc=0.3360656 val_loss=50.0506134
2025-09-08 06:43:09 INFO epoch 0029/200: lr: 0.0000100: loss=53.220893 val_acc=0.3415301 val_loss=49.9153214
2025-09-08 06:43:09 INFO epoch 0030/200: lr: 0.0000100: loss=53.062437 val_acc=0.3401639 val_loss=49.8048248
2025-09-08 06:43:09 INFO epoch 0031/200: lr: 0.0000100: loss=52.910697 val_acc=0.3428962 val_loss=49.6840439
2025-09-08 06:43:09 INFO epoch 0032/200: lr: 0.0000100: loss=52.762003 val_acc=0.3497268 val_loss=49.5668793
2025-09-08 06:43:09 INFO epoch 0033/200: lr: 0.0000100: loss=52.617509 val_acc=0.3551913 val_loss=49.4571075
2025-09-08 06:43:09 INFO epoch 0034/200: lr: 0.0000100: loss=52.477988 val_acc=0.3592896 val_loss=49.3449478
2025-09-08 06:43:09 INFO epoch 0035/200: lr: 0.0000100: loss=52.341217 val_acc=0.3620219 val_loss=49.2354202
2025-09-08 06:43:09 INFO epoch 0036/200: lr: 0.0000100: loss=52.206459 val_acc=0.3647541 val_loss=49.1418800
2025-09-08 06:43:09 INFO epoch 0037/200: lr: 0.0000100: loss=52.075810 val_acc=0.3633880 val_loss=49.0386200
2025-09-08 06:43:09 INFO epoch 0038/200: lr: 0.0000100: loss=51.947081 val_acc=0.3647541 val_loss=48.9348755
2025-09-08 06:43:09 INFO epoch 0039/200: lr: 0.0000100: loss=51.824662 val_acc=0.3674863 val_loss=48.8421745
2025-09-08 06:43:09 INFO epoch 0040/200: lr: 0.0000100: loss=51.701081 val_acc=0.3702186 val_loss=48.7444458
2025-09-08 06:43:10 INFO epoch 0041/200: lr: 0.0000100: loss=51.583117 val_acc=0.3743169 val_loss=48.6614380
2025-09-08 06:43:10 INFO epoch 0042/200: lr: 0.0000100: loss=51.465380 val_acc=0.3770492 val_loss=48.5764313
2025-09-08 06:43:10 INFO epoch 0043/200: lr: 0.0000100: loss=51.349584 val_acc=0.3797814 val_loss=48.4768791
2025-09-08 06:43:10 INFO epoch 0044/200: lr: 0.0000100: loss=51.237826 val_acc=0.3770492 val_loss=48.3893738
2025-09-08 06:43:10 INFO epoch 0045/200: lr: 0.0000100: loss=51.127965 val_acc=0.3811475 val_loss=48.3112717
2025-09-08 06:43:10 INFO epoch 0046/200: lr: 0.0000100: loss=51.020187 val_acc=0.3838798 val_loss=48.2247314
2025-09-08 06:43:10 INFO epoch 0047/200: lr: 0.0000100: loss=50.914214 val_acc=0.3825137 val_loss=48.1391373
2025-09-08 06:43:10 INFO epoch 0048/200: lr: 0.0000100: loss=50.812380 val_acc=0.3866120 val_loss=48.0684128
2025-09-08 06:43:10 INFO epoch 0049/200: lr: 0.0000100: loss=50.710667 val_acc=0.3866120 val_loss=47.9792557
2025-09-08 06:43:10 INFO epoch 0050/200: lr: 0.0000100: loss=50.611139 val_acc=0.3975410 val_loss=47.9087181
2025-09-08 06:43:10 INFO epoch 0051/200: lr: 0.0000100: loss=50.513272 val_acc=0.3975410 val_loss=47.8393707
2025-09-08 06:43:10 INFO epoch 0052/200: lr: 0.0000100: loss=50.416016 val_acc=0.3948087 val_loss=47.7598877
2025-09-08 06:43:10 INFO epoch 0053/200: lr: 0.0000100: loss=50.320529 val_acc=0.3975410 val_loss=47.6928558
2025-09-08 06:43:10 INFO epoch 0054/200: lr: 0.0000100: loss=50.228544 val_acc=0.3975410 val_loss=47.6166840
2025-09-08 06:43:10 INFO epoch 0055/200: lr: 0.0000100: loss=50.137521 val_acc=0.3975410 val_loss=47.5507278
2025-09-08 06:43:10 INFO epoch 0056/200: lr: 0.0000100: loss=50.047546 val_acc=0.3989071 val_loss=47.4808884
2025-09-08 06:43:11 INFO epoch 0057/200: lr: 0.0000100: loss=49.959463 val_acc=0.3975410 val_loss=47.4245300
2025-09-08 06:43:11 INFO epoch 0058/200: lr: 0.0000100: loss=49.872202 val_acc=0.3948087 val_loss=47.3505974
2025-09-08 06:43:11 INFO epoch 0059/200: lr: 0.0000100: loss=49.787743 val_acc=0.3989071 val_loss=47.2794952
2025-09-08 06:43:11 INFO epoch 0060/200: lr: 0.0000100: loss=49.703893 val_acc=0.3989071 val_loss=47.2301865
2025-09-08 06:43:11 INFO epoch 0061/200: lr: 0.0000100: loss=49.618657 val_acc=0.4002732 val_loss=47.1551895
2025-09-08 06:43:11 INFO epoch 0062/200: lr: 0.0000100: loss=49.537836 val_acc=0.4016393 val_loss=47.0983963
2025-09-08 06:43:11 INFO epoch 0063/200: lr: 0.0000100: loss=49.457613 val_acc=0.4016393 val_loss=47.0349426
2025-09-08 06:43:11 INFO epoch 0064/200: lr: 0.0000100: loss=49.378791 val_acc=0.4043716 val_loss=46.9693718
2025-09-08 06:43:11 INFO epoch 0065/200: lr: 0.0000100: loss=49.299622 val_acc=0.4057377 val_loss=46.9082298
2025-09-08 06:43:11 INFO epoch 0066/200: lr: 0.0000100: loss=49.223010 val_acc=0.4057377 val_loss=46.8602982
2025-09-08 06:43:11 INFO epoch 0067/200: lr: 0.0000100: loss=49.147557 val_acc=0.4071038 val_loss=46.8036423
2025-09-08 06:43:11 INFO epoch 0068/200: lr: 0.0000100: loss=49.074528 val_acc=0.4071038 val_loss=46.7398911
2025-09-08 06:43:11 INFO epoch 0069/200: lr: 0.0000100: loss=48.998798 val_acc=0.4112022 val_loss=46.6834679
2025-09-08 06:43:11 INFO epoch 0070/200: lr: 0.0000100: loss=48.926589 val_acc=0.4084699 val_loss=46.6326256
2025-09-08 06:43:11 INFO epoch 0071/200: lr: 0.0000100: loss=48.853427 val_acc=0.4125683 val_loss=46.5749931
2025-09-08 06:43:11 INFO epoch 0072/200: lr: 0.0000100: loss=48.783546 val_acc=0.4139344 val_loss=46.5119934
2025-09-08 06:43:12 INFO epoch 0073/200: lr: 0.0000100: loss=48.713162 val_acc=0.4180328 val_loss=46.4702682
2025-09-08 06:43:12 INFO epoch 0074/200: lr: 0.0000100: loss=48.645847 val_acc=0.4221311 val_loss=46.4178963
2025-09-08 06:43:12 INFO epoch 0075/200: lr: 0.0000100: loss=48.577268 val_acc=0.4221311 val_loss=46.3616066
2025-09-08 06:43:12 INFO epoch 0076/200: lr: 0.0000100: loss=48.509569 val_acc=0.4234973 val_loss=46.3092957
2025-09-08 06:43:12 INFO epoch 0077/200: lr: 0.0000100: loss=48.445286 val_acc=0.4234973 val_loss=46.2653809
2025-09-08 06:43:12 INFO epoch 0078/200: lr: 0.0000100: loss=48.379082 val_acc=0.4221311 val_loss=46.2011337
2025-09-08 06:43:12 INFO epoch 0079/200: lr: 0.0000100: loss=48.311755 val_acc=0.4248634 val_loss=46.1583366
2025-09-08 06:43:12 INFO epoch 0080/200: lr: 0.0000100: loss=48.248396 val_acc=0.4248634 val_loss=46.0977478
2025-09-08 06:43:12 INFO epoch 0081/200: lr: 0.0000100: loss=48.186768 val_acc=0.4262295 val_loss=46.0555382
2025-09-08 06:43:12 INFO epoch 0082/200: lr: 0.0000100: loss=48.123309 val_acc=0.4248634 val_loss=46.0030289
2025-09-08 06:43:12 INFO epoch 0083/200: lr: 0.0000100: loss=48.060735 val_acc=0.4275956 val_loss=45.9710083
2025-09-08 06:43:12 INFO epoch 0084/200: lr: 0.0000100: loss=47.999910 val_acc=0.4275956 val_loss=45.9204025
2025-09-08 06:43:12 INFO epoch 0085/200: lr: 0.0000100: loss=47.940302 val_acc=0.4289617 val_loss=45.8716202
2025-09-08 06:43:12 INFO epoch 0086/200: lr: 0.0000100: loss=47.880758 val_acc=0.4303279 val_loss=45.8339157
2025-09-08 06:43:12 INFO epoch 0087/200: lr: 0.0000100: loss=47.820417 val_acc=0.4330601 val_loss=45.7829475
2025-09-08 06:43:12 INFO epoch 0088/200: lr: 0.0000100: loss=47.763216 val_acc=0.4357923 val_loss=45.7428627
2025-09-08 06:43:12 INFO epoch 0089/200: lr: 0.0000100: loss=47.705780 val_acc=0.4344262 val_loss=45.6967087
2025-09-08 06:43:13 INFO epoch 0090/200: lr: 0.0000100: loss=47.647351 val_acc=0.4330601 val_loss=45.6520882
2025-09-08 06:43:13 INFO epoch 0091/200: lr: 0.0000100: loss=47.590314 val_acc=0.4344262 val_loss=45.6073608
2025-09-08 06:43:13 INFO epoch 0092/200: lr: 0.0000100: loss=47.535903 val_acc=0.4344262 val_loss=45.5593605
2025-09-08 06:43:13 INFO epoch 0093/200: lr: 0.0000100: loss=47.479613 val_acc=0.4330601 val_loss=45.5298462
2025-09-08 06:43:13 INFO epoch 0094/200: lr: 0.0000100: loss=47.425694 val_acc=0.4316940 val_loss=45.4749832
2025-09-08 06:43:13 INFO epoch 0095/200: lr: 0.0000100: loss=47.373352 val_acc=0.4303279 val_loss=45.4264603
2025-09-08 06:43:13 INFO epoch 0096/200: lr: 0.0000100: loss=47.318518 val_acc=0.4344262 val_loss=45.3970566
2025-09-08 06:43:13 INFO epoch 0097/200: lr: 0.0000100: loss=47.265424 val_acc=0.4357923 val_loss=45.3625870
2025-09-08 06:43:13 INFO epoch 0098/200: lr: 0.0000100: loss=47.213303 val_acc=0.4357923 val_loss=45.3128128
2025-09-08 06:43:13 INFO epoch 0099/200: lr: 0.0000100: loss=47.160523 val_acc=0.4398907 val_loss=45.2805634
2025-09-08 06:43:13 INFO epoch 0100/200: lr: 0.0000100: loss=47.109500 val_acc=0.4398907 val_loss=45.2418060
2025-09-08 06:43:13 INFO epoch 0101/200: lr: 0.0000100: loss=47.057875 val_acc=0.4398907 val_loss=45.1954765
2025-09-08 06:43:13 INFO epoch 0102/200: lr: 0.0000100: loss=47.007076 val_acc=0.4371585 val_loss=45.1595802
2025-09-08 06:43:13 INFO epoch 0103/200: lr: 0.0000100: loss=46.956033 val_acc=0.4398907 val_loss=45.1176300
2025-09-08 06:43:14 INFO epoch 0104/200: lr: 0.0000100: loss=46.908833 val_acc=0.4398907 val_loss=45.0856361
2025-09-08 06:43:14 INFO epoch 0105/200: lr: 0.0000100: loss=46.859893 val_acc=0.4412568 val_loss=45.0428505
2025-09-08 06:43:14 INFO epoch 0106/200: lr: 0.0000100: loss=46.809874 val_acc=0.4385246 val_loss=45.0118561
2025-09-08 06:43:14 INFO epoch 0107/200: lr: 0.0000100: loss=46.762459 val_acc=0.4385246 val_loss=44.9792099
2025-09-08 06:43:14 INFO epoch 0108/200: lr: 0.0000100: loss=46.713717 val_acc=0.4385246 val_loss=44.9323196
2025-09-08 06:43:14 INFO epoch 0109/200: lr: 0.0000100: loss=46.667894 val_acc=0.4385246 val_loss=44.8983383
2025-09-08 06:43:14 INFO epoch 0110/200: lr: 0.0000100: loss=46.622666 val_acc=0.4412568 val_loss=44.8574333
2025-09-08 06:43:14 INFO epoch 0111/200: lr: 0.0000100: loss=46.572455 val_acc=0.4426230 val_loss=44.8217468
2025-09-08 06:43:14 INFO epoch 0112/200: lr: 0.0000100: loss=46.529451 val_acc=0.4398907 val_loss=44.8120499
2025-09-08 06:43:14 INFO epoch 0113/200: lr: 0.0000100: loss=46.482762 val_acc=0.4412568 val_loss=44.7599945
2025-09-08 06:43:14 INFO epoch 0114/200: lr: 0.0000100: loss=46.435912 val_acc=0.4398907 val_loss=44.7225952
2025-09-08 06:43:14 INFO epoch 0115/200: lr: 0.0000100: loss=46.393077 val_acc=0.4426230 val_loss=44.6834869
2025-09-08 06:43:14 INFO epoch 0116/200: lr: 0.0000100: loss=46.349807 val_acc=0.4412568 val_loss=44.6600418
2025-09-08 06:43:14 INFO epoch 0117/200: lr: 0.0000100: loss=46.305982 val_acc=0.4371585 val_loss=44.6285172
2025-09-08 06:43:14 INFO epoch 0118/200: lr: 0.0000100: loss=46.260189 val_acc=0.4426230 val_loss=44.6033630
2025-09-08 06:43:14 INFO epoch 0119/200: lr: 0.0000100: loss=46.217296 val_acc=0.4439891 val_loss=44.5581322
2025-09-08 06:43:15 INFO epoch 0120/200: lr: 0.0000100: loss=46.175116 val_acc=0.4439891 val_loss=44.5216255
2025-09-08 06:43:15 INFO epoch 0121/200: lr: 0.0000100: loss=46.131034 val_acc=0.4426230 val_loss=44.4930992
2025-09-08 06:43:15 INFO epoch 0122/200: lr: 0.0000100: loss=46.090741 val_acc=0.4412568 val_loss=44.4602356
2025-09-08 06:43:15 INFO epoch 0123/200: lr: 0.0000100: loss=46.047478 val_acc=0.4426230 val_loss=44.4232826
2025-09-08 06:43:15 INFO epoch 0124/200: lr: 0.0000100: loss=46.006911 val_acc=0.4398907 val_loss=44.3961105
2025-09-08 06:43:15 INFO epoch 0125/200: lr: 0.0000100: loss=45.963561 val_acc=0.4412568 val_loss=44.3681335
2025-09-08 06:43:15 INFO epoch 0126/200: lr: 0.0000100: loss=45.922709 val_acc=0.4439891 val_loss=44.3371506
2025-09-08 06:43:15 INFO epoch 0127/200: lr: 0.0000100: loss=45.883064 val_acc=0.4439891 val_loss=44.3103027
2025-09-08 06:43:15 INFO epoch 0128/200: lr: 0.0000100: loss=45.842427 val_acc=0.4439891 val_loss=44.2845612
2025-09-08 06:43:15 INFO epoch 0129/200: lr: 0.0000100: loss=45.802533 val_acc=0.4439891 val_loss=44.2547379
2025-09-08 06:43:15 INFO epoch 0130/200: lr: 0.0000100: loss=45.763483 val_acc=0.4453552 val_loss=44.2173119
2025-09-08 06:43:15 INFO epoch 0131/200: lr: 0.0000100: loss=45.724329 val_acc=0.4453552 val_loss=44.1817970
2025-09-08 06:43:15 INFO epoch 0132/200: lr: 0.0000100: loss=45.683605 val_acc=0.4439891 val_loss=44.1568718
2025-09-08 06:43:15 INFO epoch 0133/200: lr: 0.0000100: loss=45.646000 val_acc=0.4439891 val_loss=44.1322517
2025-09-08 06:43:15 INFO epoch 0134/200: lr: 0.0000100: loss=45.608314 val_acc=0.4453552 val_loss=44.0967140
2025-09-08 06:43:15 INFO epoch 0135/200: lr: 0.0000100: loss=45.568003 val_acc=0.4453552 val_loss=44.0797844
2025-09-08 06:43:15 INFO epoch 0136/200: lr: 0.0000100: loss=45.531258 val_acc=0.4453552 val_loss=44.0438995
2025-09-08 06:43:16 INFO epoch 0137/200: lr: 0.0000100: loss=45.491566 val_acc=0.4453552 val_loss=44.0107498
2025-09-08 06:43:16 INFO epoch 0138/200: lr: 0.0000100: loss=45.454735 val_acc=0.4439891 val_loss=43.9843597
2025-09-08 06:43:16 INFO epoch 0139/200: lr: 0.0000100: loss=45.419740 val_acc=0.4439891 val_loss=43.9489136
2025-09-08 06:43:16 INFO epoch 0140/200: lr: 0.0000100: loss=45.382954 val_acc=0.4439891 val_loss=43.9372597
2025-09-08 06:43:16 INFO epoch 0141/200: lr: 0.0000100: loss=45.343647 val_acc=0.4439891 val_loss=43.9066391
2025-09-08 06:43:16 INFO epoch 0142/200: lr: 0.0000100: loss=45.308323 val_acc=0.4467213 val_loss=43.8753853
2025-09-08 06:43:16 INFO epoch 0143/200: lr: 0.0000100: loss=45.274029 val_acc=0.4494536 val_loss=43.8576660
2025-09-08 06:43:16 INFO epoch 0144/200: lr: 0.0000100: loss=45.236236 val_acc=0.4467213 val_loss=43.8337021
2025-09-08 06:43:16 INFO epoch 0145/200: lr: 0.0000100: loss=45.202005 val_acc=0.4480874 val_loss=43.7930870
2025-09-08 06:43:16 INFO epoch 0146/200: lr: 0.0000100: loss=45.167706 val_acc=0.4467213 val_loss=43.7638664
2025-09-08 06:43:16 INFO epoch 0147/200: lr: 0.0000100: loss=45.131542 val_acc=0.4480874 val_loss=43.7504883
2025-09-08 06:43:16 INFO epoch 0148/200: lr: 0.0000100: loss=45.096967 val_acc=0.4480874 val_loss=43.7180672
2025-09-08 06:43:16 INFO epoch 0149/200: lr: 0.0000100: loss=45.062284 val_acc=0.4494536 val_loss=43.6964073
2025-09-08 06:43:16 INFO epoch 0150/200: lr: 0.0000100: loss=45.027622 val_acc=0.4494536 val_loss=43.6635818
2025-09-08 06:43:16 INFO epoch 0151/200: lr: 0.0000100: loss=44.993549 val_acc=0.4480874 val_loss=43.6473656
2025-09-08 06:43:16 INFO epoch 0152/200: lr: 0.0000100: loss=44.958767 val_acc=0.4439891 val_loss=43.6061096
2025-09-08 06:43:16 INFO epoch 0153/200: lr: 0.0000100: loss=44.927254 val_acc=0.4426230 val_loss=43.5892067
2025-09-08 06:43:17 INFO epoch 0154/200: lr: 0.0000100: loss=44.892204 val_acc=0.4467213 val_loss=43.5752220
2025-09-08 06:43:17 INFO epoch 0155/200: lr: 0.0000100: loss=44.858678 val_acc=0.4467213 val_loss=43.5531921
2025-09-08 06:43:17 INFO epoch 0156/200: lr: 0.0000100: loss=44.825128 val_acc=0.4467213 val_loss=43.5203018
2025-09-08 06:43:17 INFO epoch 0157/200: lr: 0.0000100: loss=44.792979 val_acc=0.4480874 val_loss=43.4950714
2025-09-08 06:43:17 INFO epoch 0158/200: lr: 0.0000100: loss=44.760559 val_acc=0.4480874 val_loss=43.4665985
2025-09-08 06:43:17 INFO epoch 0159/200: lr: 0.0000100: loss=44.728826 val_acc=0.4467213 val_loss=43.4493332
2025-09-08 06:43:17 INFO epoch 0160/200: lr: 0.0000100: loss=44.696254 val_acc=0.4508197 val_loss=43.4298744
2025-09-08 06:43:17 INFO epoch 0161/200: lr: 0.0000100: loss=44.663239 val_acc=0.4508197 val_loss=43.3995285
2025-09-08 06:43:17 INFO epoch 0162/200: lr: 0.0000100: loss=44.630967 val_acc=0.4494536 val_loss=43.3784409
2025-09-08 06:43:17 INFO epoch 0163/200: lr: 0.0000100: loss=44.599509 val_acc=0.4494536 val_loss=43.3524170
2025-09-08 06:43:17 INFO epoch 0164/200: lr: 0.0000100: loss=44.570994 val_acc=0.4508197 val_loss=43.3331757
2025-09-08 06:43:17 INFO epoch 0165/200: lr: 0.0000100: loss=44.537694 val_acc=0.4494536 val_loss=43.3169098
2025-09-08 06:43:17 INFO epoch 0166/200: lr: 0.0000100: loss=44.506383 val_acc=0.4508197 val_loss=43.2888794
2025-09-08 06:43:17 INFO epoch 0167/200: lr: 0.0000100: loss=44.475818 val_acc=0.4494536 val_loss=43.2723808
2025-09-08 06:43:17 INFO epoch 0168/200: lr: 0.0000100: loss=44.445066 val_acc=0.4494536 val_loss=43.2386360
2025-09-08 06:43:17 INFO epoch 0169/200: lr: 0.0000100: loss=44.413960 val_acc=0.4494536 val_loss=43.2155304
2025-09-08 06:43:18 INFO epoch 0170/200: lr: 0.0000100: loss=44.385331 val_acc=0.4480874 val_loss=43.2007332
2025-09-08 06:43:18 INFO epoch 0171/200: lr: 0.0000100: loss=44.352959 val_acc=0.4480874 val_loss=43.1830940
2025-09-08 06:43:18 INFO epoch 0172/200: lr: 0.0000100: loss=44.323279 val_acc=0.4480874 val_loss=43.1580505
2025-09-08 06:43:18 INFO epoch 0173/200: lr: 0.0000100: loss=44.297504 val_acc=0.4494536 val_loss=43.1309547
2025-09-08 06:43:18 INFO epoch 0174/200: lr: 0.0000100: loss=44.266577 val_acc=0.4480874 val_loss=43.1101265
2025-09-08 06:43:18 INFO epoch 0175/200: lr: 0.0000100: loss=44.235062 val_acc=0.4508197 val_loss=43.0879593
2025-09-08 06:43:18 INFO epoch 0176/200: lr: 0.0000100: loss=44.205409 val_acc=0.4494536 val_loss=43.0773582
2025-09-08 06:43:18 INFO epoch 0177/200: lr: 0.0000100: loss=44.176400 val_acc=0.4508197 val_loss=43.0549431
2025-09-08 06:43:18 INFO epoch 0178/200: lr: 0.0000100: loss=44.147894 val_acc=0.4494536 val_loss=43.0342598
2025-09-08 06:43:18 INFO epoch 0179/200: lr: 0.0000100: loss=44.118099 val_acc=0.4508197 val_loss=43.0072060
2025-09-08 06:43:18 INFO epoch 0180/200: lr: 0.0000100: loss=44.089488 val_acc=0.4494536 val_loss=42.9852066
2025-09-08 06:43:18 INFO epoch 0181/200: lr: 0.0000100: loss=44.061135 val_acc=0.4508197 val_loss=42.9631119
2025-09-08 06:43:18 INFO epoch 0182/200: lr: 0.0000100: loss=44.035253 val_acc=0.4508197 val_loss=42.9427872
2025-09-08 06:43:18 INFO epoch 0183/200: lr: 0.0000100: loss=44.006112 val_acc=0.4521858 val_loss=42.9313393
2025-09-08 06:43:19 INFO epoch 0184/200: lr: 0.0000100: loss=43.977240 val_acc=0.4535519 val_loss=42.9015045
2025-09-08 06:43:19 INFO epoch 0185/200: lr: 0.0000100: loss=43.950785 val_acc=0.4535519 val_loss=42.8778076
2025-09-08 06:43:19 INFO epoch 0186/200: lr: 0.0000100: loss=43.919567 val_acc=0.4535519 val_loss=42.8670120
2025-09-08 06:43:19 INFO epoch 0187/200: lr: 0.0000100: loss=43.893733 val_acc=0.4562842 val_loss=42.8576241
2025-09-08 06:43:19 INFO epoch 0188/200: lr: 0.0000100: loss=43.866345 val_acc=0.4549180 val_loss=42.8327293
2025-09-08 06:43:19 INFO epoch 0189/200: lr: 0.0000100: loss=43.838491 val_acc=0.4562842 val_loss=42.8067245
2025-09-08 06:43:19 INFO epoch 0190/200: lr: 0.0000100: loss=43.810656 val_acc=0.4562842 val_loss=42.7914848
2025-09-08 06:43:19 INFO epoch 0191/200: lr: 0.0000100: loss=43.786119 val_acc=0.4576503 val_loss=42.7670746
2025-09-08 06:43:19 INFO epoch 0192/200: lr: 0.0000100: loss=43.757301 val_acc=0.4590164 val_loss=42.7519341
2025-09-08 06:43:19 INFO epoch 0193/200: lr: 0.0000100: loss=43.730661 val_acc=0.4590164 val_loss=42.7299423
2025-09-08 06:43:19 INFO epoch 0194/200: lr: 0.0000100: loss=43.704858 val_acc=0.4603825 val_loss=42.7147064
2025-09-08 06:43:19 INFO epoch 0195/200: lr: 0.0000100: loss=43.677971 val_acc=0.4631148 val_loss=42.6869736
2025-09-08 06:43:19 INFO epoch 0196/200: lr: 0.0000100: loss=43.652594 val_acc=0.4617486 val_loss=42.6763420
2025-09-08 06:43:19 INFO epoch 0197/200: lr: 0.0000100: loss=43.626217 val_acc=0.4644809 val_loss=42.6635132
2025-09-08 06:43:19 INFO epoch 0198/200: lr: 0.0000100: loss=43.599288 val_acc=0.4644809 val_loss=42.6441269
2025-09-08 06:43:19 INFO epoch 0199/200: lr: 0.0000100: loss=43.572678 val_acc=0.4658470 val_loss=42.6270065
2025-09-08 06:43:19 INFO epoch 0200/200: lr: 0.0000100: loss=43.547372 val_acc=0.4631148 val_loss=42.6055527
2025-09-08 06:43:19 INFO Training complete in 0m 13s
2025-09-08 06:43:19 INFO Best val_acc@199 = 0.46584699453551914
2025-09-08 06:43:19 INFO Best val_loss@199 = 42.62700653076172
2025-09-08 06:43:20 INFO  stats|test: mean=0.0003, std=1.0572
2025-09-08 06:43:20 INFO Linear evaluation: default_0_2025-09-05_16-17-52-checkpoint_last_cremad_8aab132f cremad -> 0.45583
{'audio_repr': 'ar_eat.AR_EAT', 'weight_file': '/opt/gpfs/home/chushu/exp/eat/pre_4_AS2M/default_0_2025-09-05_16-17-52/checkpoint_last.pt', 'feature_d': 768, 'sample_rate': 16000, 'target_length': 1024, 'framework': 'fairseq', 'mode': 'finetune', 'prediction_mode': 'CLS_TOKEN', 'model_dir': '/opt/gpfs/home/chushu/codes/2506/EAT/EAT', 'batch_size': 16, 'lr_lineareval': 3e-05, 'report_per_epochs': 50, 'early_stop_epochs': 20, 'training_mask': 0.0, 'warmup_epochs': 5, 'mixup': 0.5, 'ft_bs': 128, 'ft_lr': 2.0, 'ft_early_stop_epochs': -1, 'ft_epochs': 200, 'ft_freq_mask': 30, 'ft_time_mask': 192, 'ft_noise': 0.0, 'ft_rrc': True, 'name': '', 'task_metadata': '/opt/gpfs/home/chushu/codes/2506/EAT/evar/evar/metadata/cremad.csv', 'task_data': '/opt/gpfs/data/raw_data/cremad/16k', 'unit_samples': 40000, 'id': 'default_0_2025-09-05_16-17-52-checkpoint_last_cremad_764ad5e5', 'task_name': 'cremad', 'return_filename': False, 'mean': None, 'std': None, 'runtime_cfg': {'lr': 1e-05, 'seed': 42, 'hidden': (), 'standard_scaler': True, 'mixup': False, 'epochs': 200, 'early_stop_epochs': 20, 'id': '50d291e1'}}
/opt/gpfs/home/chushu/codes/2506/EAT/evar/logs/default_0_2025-09-05_16-17-52-checkpoint_last_cremad_764ad5e5/default-0-2025-09-05-16-17-52-checkpoint-last-cremad-LE_8aab132f_0.45583.csv
2025-09-08 06:43:20 INFO  -> /opt/gpfs/home/chushu/codes/2506/EAT/evar/results/scores.csv
2025-09-08 06:43:25 INFO {'audio_repr': 'ar_eat.AR_EAT', 'weight_file': '/opt/gpfs/home/chushu/exp/eat/pre_4_AS2M/default_0_2025-09-05_16-17-52/checkpoint_last.pt', 'feature_d': 768, 'sample_rate': 16000, 'target_length': 1024, 'framework': 'fairseq', 'mode': 'finetune', 'prediction_mode': 'CLS_TOKEN', 'model_dir': '/opt/gpfs/home/chushu/codes/2506/EAT/EAT', 'batch_size': 16, 'lr_lineareval': 3e-05, 'report_per_epochs': 50, 'early_stop_epochs': 20, 'training_mask': 0.0, 'warmup_epochs': 5, 'mixup': 0.5, 'ft_bs': 128, 'ft_lr': 2.0, 'ft_early_stop_epochs': -1, 'ft_epochs': 200, 'ft_freq_mask': 30, 'ft_time_mask': 192, 'ft_noise': 0.0, 'ft_rrc': True, 'name': '', 'task_metadata': '/opt/gpfs/home/chushu/codes/2506/EAT/evar/evar/metadata/cremad.csv', 'task_data': '/opt/gpfs/data/raw_data/cremad/16k', 'unit_samples': 40000, 'id': 'default_0_2025-09-05_16-17-52-checkpoint_last_cremad_764ad5e5', 'task_name': 'cremad', 'return_filename': False, 'mean': None, 'std': None, 'runtime_cfg': {'lr': 1e-05, 'seed': 43, 'hidden': (), 'standard_scaler': True, 'mixup': False, 'epochs': 200, 'early_stop_epochs': 20, 'id': '7d7f1d32'}}
2025-09-08 06:43:25 INFO  classes: ['ANG', 'DIS', 'FEA', 'HAP', 'NEU', 'SAD']
2025-09-08 06:43:25 INFO Train:5155, valid:732, test:1551, multi label:False
2025-09-08 06:43:25 INFO  using cached embeddings: embs-default_0_2025-09-05_16-17-52-checkpoint_last_cremad_764ad5e5-train-1
2025-09-08 06:43:25 INFO  using cached embeddings: embs-default_0_2025-09-05_16-17-52-checkpoint_last_cremad_764ad5e5-valid-1
2025-09-08 06:43:25 INFO  using cached embeddings: embs-default_0_2025-09-05_16-17-52-checkpoint_last_cremad_764ad5e5-test-1
2025-09-08 06:43:25 INFO 🚀 Started Linear evaluation:
2025-09-08 06:43:25 INFO  stats|train: mean=0.0000, std=1.0000
2025-09-08 06:43:25 INFO  stats|valid: mean=-0.0012, std=1.0562
2025-09-08 06:43:26 INFO Training model: MLP(
  (mlp): Sequential(
    (0): Linear(in_features=768, out_features=6, bias=True)
  )
)
2025-09-08 06:43:26 INFO Details - metric: acc, loss: <function loss_nll_with_logits at 0x7f05553409d0>, optimizer: Adam (
Parameter Group 0
    amsgrad: False
    betas: (0.9, 0.999)
    capturable: False
    decoupled_weight_decay: False
    differentiable: False
    eps: 1e-08
    foreach: None
    fused: None
    lr: 1e-05
    maximize: False
    weight_decay: 1e-08
), n_class: 6
2025-09-08 06:43:26 INFO epoch 0001/200: lr: 0.0000100: loss=62.623043 val_acc=0.1994536 val_loss=58.1137161
2025-09-08 06:43:26 INFO epoch 0002/200: lr: 0.0000100: loss=61.704965 val_acc=0.2103825 val_loss=57.2573242
2025-09-08 06:43:26 INFO epoch 0003/200: lr: 0.0000100: loss=60.923490 val_acc=0.2144809 val_loss=56.5211563
2025-09-08 06:43:26 INFO epoch 0004/200: lr: 0.0000100: loss=60.258354 val_acc=0.2158470 val_loss=55.8946495
2025-09-08 06:43:26 INFO epoch 0005/200: lr: 0.0000100: loss=59.674062 val_acc=0.2185792 val_loss=55.3542633
2025-09-08 06:43:26 INFO epoch 0006/200: lr: 0.0000100: loss=59.165915 val_acc=0.2295082 val_loss=54.8859177
2025-09-08 06:43:26 INFO epoch 0007/200: lr: 0.0000100: loss=58.711550 val_acc=0.2377049 val_loss=54.4558411
2025-09-08 06:43:26 INFO epoch 0008/200: lr: 0.0000100: loss=58.299720 val_acc=0.2404372 val_loss=54.0741463
2025-09-08 06:43:26 INFO epoch 0009/200: lr: 0.0000100: loss=57.925279 val_acc=0.2459016 val_loss=53.7251892
2025-09-08 06:43:26 INFO epoch 0010/200: lr: 0.0000100: loss=57.575936 val_acc=0.2595628 val_loss=53.3999100
2025-09-08 06:43:27 INFO epoch 0011/200: lr: 0.0000100: loss=57.251860 val_acc=0.2677596 val_loss=53.1077423
2025-09-08 06:43:27 INFO epoch 0012/200: lr: 0.0000100: loss=56.950255 val_acc=0.2800546 val_loss=52.8406029
2025-09-08 06:43:27 INFO epoch 0013/200: lr: 0.0000100: loss=56.664029 val_acc=0.2786885 val_loss=52.5852585
2025-09-08 06:43:27 INFO epoch 0014/200: lr: 0.0000100: loss=56.392067 val_acc=0.2882514 val_loss=52.3480148
2025-09-08 06:43:27 INFO epoch 0015/200: lr: 0.0000100: loss=56.136815 val_acc=0.2896175 val_loss=52.1265259
2025-09-08 06:43:27 INFO epoch 0016/200: lr: 0.0000100: loss=55.891742 val_acc=0.2978142 val_loss=51.9094009
2025-09-08 06:43:27 INFO epoch 0017/200: lr: 0.0000100: loss=55.654147 val_acc=0.3005464 val_loss=51.7124290
2025-09-08 06:43:27 INFO epoch 0018/200: lr: 0.0000100: loss=55.430190 val_acc=0.3032787 val_loss=51.5289917
2025-09-08 06:43:27 INFO epoch 0019/200: lr: 0.0000100: loss=55.213453 val_acc=0.3087432 val_loss=51.3434563
2025-09-08 06:43:27 INFO epoch 0020/200: lr: 0.0000100: loss=55.005362 val_acc=0.3101093 val_loss=51.1668396
2025-09-08 06:43:27 INFO epoch 0021/200: lr: 0.0000100: loss=54.803174 val_acc=0.3155738 val_loss=51.0079079
2025-09-08 06:43:27 INFO epoch 0022/200: lr: 0.0000100: loss=54.611725 val_acc=0.3224044 val_loss=50.8487625
2025-09-08 06:43:27 INFO epoch 0023/200: lr: 0.0000100: loss=54.421479 val_acc=0.3292350 val_loss=50.6994629
2025-09-08 06:43:27 INFO epoch 0024/200: lr: 0.0000100: loss=54.241548 val_acc=0.3306011 val_loss=50.5490761
2025-09-08 06:43:27 INFO epoch 0025/200: lr: 0.0000100: loss=54.064836 val_acc=0.3387978 val_loss=50.4111366
2025-09-08 06:43:27 INFO epoch 0026/200: lr: 0.0000100: loss=53.894680 val_acc=0.3442623 val_loss=50.2777405
2025-09-08 06:43:28 INFO epoch 0027/200: lr: 0.0000100: loss=53.728407 val_acc=0.3469945 val_loss=50.1413918
2025-09-08 06:43:28 INFO epoch 0028/200: lr: 0.0000100: loss=53.567196 val_acc=0.3497268 val_loss=50.0142136
2025-09-08 06:43:28 INFO epoch 0029/200: lr: 0.0000100: loss=53.411064 val_acc=0.3524590 val_loss=49.8892250
2025-09-08 06:43:28 INFO epoch 0030/200: lr: 0.0000100: loss=53.258632 val_acc=0.3524590 val_loss=49.7737427
2025-09-08 06:43:28 INFO epoch 0031/200: lr: 0.0000100: loss=53.109221 val_acc=0.3510929 val_loss=49.6562805
2025-09-08 06:43:28 INFO epoch 0032/200: lr: 0.0000100: loss=52.964993 val_acc=0.3497268 val_loss=49.5450592
2025-09-08 06:43:28 INFO epoch 0033/200: lr: 0.0000100: loss=52.824049 val_acc=0.3538251 val_loss=49.4306183
2025-09-08 06:43:28 INFO epoch 0034/200: lr: 0.0000100: loss=52.686524 val_acc=0.3524590 val_loss=49.3292160
2025-09-08 06:43:28 INFO epoch 0035/200: lr: 0.0000100: loss=52.552925 val_acc=0.3565574 val_loss=49.2214050
2025-09-08 06:43:28 INFO epoch 0036/200: lr: 0.0000100: loss=52.421025 val_acc=0.3579235 val_loss=49.1251221
2025-09-08 06:43:28 INFO epoch 0037/200: lr: 0.0000100: loss=52.293582 val_acc=0.3592896 val_loss=49.0266418
2025-09-08 06:43:28 INFO epoch 0038/200: lr: 0.0000100: loss=52.168401 val_acc=0.3606557 val_loss=48.9272308
2025-09-08 06:43:28 INFO epoch 0039/200: lr: 0.0000100: loss=52.045874 val_acc=0.3579235 val_loss=48.8311043
2025-09-08 06:43:29 INFO epoch 0040/200: lr: 0.0000100: loss=51.925891 val_acc=0.3647541 val_loss=48.7463264
2025-09-08 06:43:29 INFO epoch 0041/200: lr: 0.0000100: loss=51.809038 val_acc=0.3661202 val_loss=48.6573410
2025-09-08 06:43:29 INFO epoch 0042/200: lr: 0.0000100: loss=51.692630 val_acc=0.3647541 val_loss=48.5636253
2025-09-08 06:43:29 INFO epoch 0043/200: lr: 0.0000100: loss=51.580956 val_acc=0.3688525 val_loss=48.4717522
2025-09-08 06:43:29 INFO epoch 0044/200: lr: 0.0000100: loss=51.468046 val_acc=0.3715847 val_loss=48.3942223
2025-09-08 06:43:29 INFO epoch 0045/200: lr: 0.0000100: loss=51.359971 val_acc=0.3702186 val_loss=48.3079109
2025-09-08 06:43:29 INFO epoch 0046/200: lr: 0.0000100: loss=51.255078 val_acc=0.3729508 val_loss=48.2236214
2025-09-08 06:43:29 INFO epoch 0047/200: lr: 0.0000100: loss=51.148455 val_acc=0.3743169 val_loss=48.1481400
2025-09-08 06:43:29 INFO epoch 0048/200: lr: 0.0000100: loss=51.047465 val_acc=0.3784153 val_loss=48.0726662
2025-09-08 06:43:29 INFO epoch 0049/200: lr: 0.0000100: loss=50.945448 val_acc=0.3770492 val_loss=47.9942017
2025-09-08 06:43:29 INFO epoch 0050/200: lr: 0.0000100: loss=50.847723 val_acc=0.3715847 val_loss=47.9146080
2025-09-08 06:43:29 INFO epoch 0051/200: lr: 0.0000100: loss=50.750819 val_acc=0.3729508 val_loss=47.8388977
2025-09-08 06:43:29 INFO epoch 0052/200: lr: 0.0000100: loss=50.655569 val_acc=0.3743169 val_loss=47.7675667
2025-09-08 06:43:29 INFO epoch 0053/200: lr: 0.0000100: loss=50.559358 val_acc=0.3784153 val_loss=47.6938286
2025-09-08 06:43:29 INFO epoch 0054/200: lr: 0.0000100: loss=50.467862 val_acc=0.3797814 val_loss=47.6258430
2025-09-08 06:43:29 INFO epoch 0055/200: lr: 0.0000100: loss=50.378102 val_acc=0.3838798 val_loss=47.5518723
2025-09-08 06:43:29 INFO epoch 0056/200: lr: 0.0000100: loss=50.287274 val_acc=0.3825137 val_loss=47.4829330
2025-09-08 06:43:30 INFO epoch 0057/200: lr: 0.0000100: loss=50.201325 val_acc=0.3825137 val_loss=47.4170189
2025-09-08 06:43:30 INFO epoch 0058/200: lr: 0.0000100: loss=50.111381 val_acc=0.3825137 val_loss=47.3526459
2025-09-08 06:43:30 INFO epoch 0059/200: lr: 0.0000100: loss=50.025454 val_acc=0.3838798 val_loss=47.2870560
2025-09-08 06:43:30 INFO epoch 0060/200: lr: 0.0000100: loss=49.943104 val_acc=0.3907104 val_loss=47.2202492
2025-09-08 06:43:30 INFO epoch 0061/200: lr: 0.0000100: loss=49.861142 val_acc=0.3920765 val_loss=47.1670074
2025-09-08 06:43:30 INFO epoch 0062/200: lr: 0.0000100: loss=49.778158 val_acc=0.3961749 val_loss=47.0954475
2025-09-08 06:43:30 INFO epoch 0063/200: lr: 0.0000100: loss=49.696426 val_acc=0.3961749 val_loss=47.0302811
2025-09-08 06:43:30 INFO epoch 0064/200: lr: 0.0000100: loss=49.618910 val_acc=0.3961749 val_loss=46.9716415
2025-09-08 06:43:30 INFO epoch 0065/200: lr: 0.0000100: loss=49.539383 val_acc=0.3948087 val_loss=46.9082451
2025-09-08 06:43:30 INFO epoch 0066/200: lr: 0.0000100: loss=49.460829 val_acc=0.4002732 val_loss=46.8578529
2025-09-08 06:43:30 INFO epoch 0067/200: lr: 0.0000100: loss=49.386441 val_acc=0.3989071 val_loss=46.8035278
2025-09-08 06:43:30 INFO epoch 0068/200: lr: 0.0000100: loss=49.309336 val_acc=0.3989071 val_loss=46.7318459
2025-09-08 06:43:30 INFO epoch 0069/200: lr: 0.0000100: loss=49.236702 val_acc=0.4002732 val_loss=46.6776543
2025-09-08 06:43:30 INFO epoch 0070/200: lr: 0.0000100: loss=49.163914 val_acc=0.4030055 val_loss=46.6293106
2025-09-08 06:43:30 INFO epoch 0071/200: lr: 0.0000100: loss=49.092761 val_acc=0.4057377 val_loss=46.5671425
2025-09-08 06:43:30 INFO epoch 0072/200: lr: 0.0000100: loss=49.020576 val_acc=0.4043716 val_loss=46.5114403
2025-09-08 06:43:31 INFO epoch 0073/200: lr: 0.0000100: loss=48.949410 val_acc=0.4016393 val_loss=46.4596710
2025-09-08 06:43:31 INFO epoch 0074/200: lr: 0.0000100: loss=48.879104 val_acc=0.4043716 val_loss=46.4022408
2025-09-08 06:43:31 INFO epoch 0075/200: lr: 0.0000100: loss=48.812422 val_acc=0.4043716 val_loss=46.3509560
2025-09-08 06:43:31 INFO epoch 0076/200: lr: 0.0000100: loss=48.743721 val_acc=0.4016393 val_loss=46.2935944
2025-09-08 06:43:31 INFO epoch 0077/200: lr: 0.0000100: loss=48.676247 val_acc=0.4043716 val_loss=46.2498627
2025-09-08 06:43:31 INFO epoch 0078/200: lr: 0.0000100: loss=48.610969 val_acc=0.4057377 val_loss=46.1908264
2025-09-08 06:43:31 INFO epoch 0079/200: lr: 0.0000100: loss=48.546317 val_acc=0.4098361 val_loss=46.1485634
2025-09-08 06:43:31 INFO epoch 0080/200: lr: 0.0000100: loss=48.481857 val_acc=0.4098361 val_loss=46.0967865
2025-09-08 06:43:31 INFO epoch 0081/200: lr: 0.0000100: loss=48.416216 val_acc=0.4084699 val_loss=46.0429001
2025-09-08 06:43:31 INFO epoch 0082/200: lr: 0.0000100: loss=48.352764 val_acc=0.4112022 val_loss=45.9938812
2025-09-08 06:43:31 INFO epoch 0083/200: lr: 0.0000100: loss=48.289712 val_acc=0.4112022 val_loss=45.9471855
2025-09-08 06:43:31 INFO epoch 0084/200: lr: 0.0000100: loss=48.229457 val_acc=0.4112022 val_loss=45.8971214
2025-09-08 06:43:31 INFO epoch 0085/200: lr: 0.0000100: loss=48.166861 val_acc=0.4153005 val_loss=45.8480568
2025-09-08 06:43:31 INFO epoch 0086/200: lr: 0.0000100: loss=48.106353 val_acc=0.4139344 val_loss=45.8047943
2025-09-08 06:43:31 INFO epoch 0087/200: lr: 0.0000100: loss=48.046922 val_acc=0.4112022 val_loss=45.7597733
2025-09-08 06:43:31 INFO epoch 0088/200: lr: 0.0000100: loss=47.990880 val_acc=0.4098361 val_loss=45.7195740
2025-09-08 06:43:31 INFO epoch 0089/200: lr: 0.0000100: loss=47.930661 val_acc=0.4125683 val_loss=45.6710815
2025-09-08 06:43:32 INFO epoch 0090/200: lr: 0.0000100: loss=47.871752 val_acc=0.4125683 val_loss=45.6321487
2025-09-08 06:43:32 INFO epoch 0091/200: lr: 0.0000100: loss=47.815082 val_acc=0.4112022 val_loss=45.5788002
2025-09-08 06:43:32 INFO epoch 0092/200: lr: 0.0000100: loss=47.759609 val_acc=0.4125683 val_loss=45.5344200
2025-09-08 06:43:32 INFO epoch 0093/200: lr: 0.0000100: loss=47.702328 val_acc=0.4139344 val_loss=45.4858932
2025-09-08 06:43:32 INFO epoch 0094/200: lr: 0.0000100: loss=47.648629 val_acc=0.4139344 val_loss=45.4511185
2025-09-08 06:43:32 INFO epoch 0095/200: lr: 0.0000100: loss=47.591575 val_acc=0.4166667 val_loss=45.4088516
2025-09-08 06:43:32 INFO epoch 0096/200: lr: 0.0000100: loss=47.538220 val_acc=0.4153005 val_loss=45.3662682
2025-09-08 06:43:32 INFO epoch 0097/200: lr: 0.0000100: loss=47.484647 val_acc=0.4153005 val_loss=45.3333511
2025-09-08 06:43:32 INFO epoch 0098/200: lr: 0.0000100: loss=47.427476 val_acc=0.4153005 val_loss=45.2761841
2025-09-08 06:43:32 INFO epoch 0099/200: lr: 0.0000100: loss=47.379862 val_acc=0.4166667 val_loss=45.2392197
2025-09-08 06:43:32 INFO epoch 0100/200: lr: 0.0000100: loss=47.325111 val_acc=0.4180328 val_loss=45.1990395
2025-09-08 06:43:32 INFO epoch 0101/200: lr: 0.0000100: loss=47.272034 val_acc=0.4193989 val_loss=45.1603928
2025-09-08 06:43:32 INFO epoch 0102/200: lr: 0.0000100: loss=47.220596 val_acc=0.4207650 val_loss=45.1235695
2025-09-08 06:43:32 INFO epoch 0103/200: lr: 0.0000100: loss=47.171286 val_acc=0.4207650 val_loss=45.0786743
2025-09-08 06:43:33 INFO epoch 0104/200: lr: 0.0000100: loss=47.121021 val_acc=0.4221311 val_loss=45.0415192
2025-09-08 06:43:33 INFO epoch 0105/200: lr: 0.0000100: loss=47.070298 val_acc=0.4234973 val_loss=45.0070419
2025-09-08 06:43:33 INFO epoch 0106/200: lr: 0.0000100: loss=47.020703 val_acc=0.4207650 val_loss=44.9724045
2025-09-08 06:43:33 INFO epoch 0107/200: lr: 0.0000100: loss=46.973923 val_acc=0.4234973 val_loss=44.9254494
2025-09-08 06:43:33 INFO epoch 0108/200: lr: 0.0000100: loss=46.922827 val_acc=0.4234973 val_loss=44.8946152
2025-09-08 06:43:33 INFO epoch 0109/200: lr: 0.0000100: loss=46.876497 val_acc=0.4221311 val_loss=44.8578568
2025-09-08 06:43:33 INFO epoch 0110/200: lr: 0.0000100: loss=46.828987 val_acc=0.4248634 val_loss=44.8201218
2025-09-08 06:43:33 INFO epoch 0111/200: lr: 0.0000100: loss=46.781621 val_acc=0.4248634 val_loss=44.7893829
2025-09-08 06:43:33 INFO epoch 0112/200: lr: 0.0000100: loss=46.732870 val_acc=0.4262295 val_loss=44.7450256
2025-09-08 06:43:33 INFO epoch 0113/200: lr: 0.0000100: loss=46.687416 val_acc=0.4234973 val_loss=44.7089195
2025-09-08 06:43:33 INFO epoch 0114/200: lr: 0.0000100: loss=46.641903 val_acc=0.4275956 val_loss=44.6715622
2025-09-08 06:43:33 INFO epoch 0115/200: lr: 0.0000100: loss=46.595091 val_acc=0.4262295 val_loss=44.6469231
2025-09-08 06:43:33 INFO epoch 0116/200: lr: 0.0000100: loss=46.550888 val_acc=0.4275956 val_loss=44.6067886
2025-09-08 06:43:33 INFO epoch 0117/200: lr: 0.0000100: loss=46.504003 val_acc=0.4289617 val_loss=44.5699348
2025-09-08 06:43:33 INFO epoch 0118/200: lr: 0.0000100: loss=46.459309 val_acc=0.4289617 val_loss=44.5378838
2025-09-08 06:43:33 INFO epoch 0119/200: lr: 0.0000100: loss=46.416002 val_acc=0.4275956 val_loss=44.5034332
2025-09-08 06:43:33 INFO epoch 0120/200: lr: 0.0000100: loss=46.371387 val_acc=0.4289617 val_loss=44.4670143
2025-09-08 06:43:34 INFO epoch 0121/200: lr: 0.0000100: loss=46.327678 val_acc=0.4289617 val_loss=44.4360161
2025-09-08 06:43:34 INFO epoch 0122/200: lr: 0.0000100: loss=46.285763 val_acc=0.4275956 val_loss=44.4044914
2025-09-08 06:43:34 INFO epoch 0123/200: lr: 0.0000100: loss=46.243383 val_acc=0.4303279 val_loss=44.3653984
2025-09-08 06:43:34 INFO epoch 0124/200: lr: 0.0000100: loss=46.199340 val_acc=0.4289617 val_loss=44.3408737
2025-09-08 06:43:34 INFO epoch 0125/200: lr: 0.0000100: loss=46.159414 val_acc=0.4289617 val_loss=44.3042717
2025-09-08 06:43:34 INFO epoch 0126/200: lr: 0.0000100: loss=46.115873 val_acc=0.4275956 val_loss=44.2738800
2025-09-08 06:43:34 INFO epoch 0127/200: lr: 0.0000100: loss=46.073724 val_acc=0.4275956 val_loss=44.2509575
2025-09-08 06:43:34 INFO epoch 0128/200: lr: 0.0000100: loss=46.033992 val_acc=0.4289617 val_loss=44.2121544
2025-09-08 06:43:34 INFO epoch 0129/200: lr: 0.0000100: loss=45.994485 val_acc=0.4289617 val_loss=44.1852455
2025-09-08 06:43:34 INFO epoch 0130/200: lr: 0.0000100: loss=45.951433 val_acc=0.4289617 val_loss=44.1608658
2025-09-08 06:43:34 INFO epoch 0131/200: lr: 0.0000100: loss=45.913206 val_acc=0.4303279 val_loss=44.1174850
2025-09-08 06:43:34 INFO epoch 0132/200: lr: 0.0000100: loss=45.870783 val_acc=0.4289617 val_loss=44.0928726
2025-09-08 06:43:34 INFO epoch 0133/200: lr: 0.0000100: loss=45.830923 val_acc=0.4289617 val_loss=44.0634956
2025-09-08 06:43:34 INFO epoch 0134/200: lr: 0.0000100: loss=45.794823 val_acc=0.4275956 val_loss=44.0225449
2025-09-08 06:43:34 INFO epoch 0135/200: lr: 0.0000100: loss=45.753561 val_acc=0.4275956 val_loss=44.0074463
2025-09-08 06:43:34 INFO epoch 0136/200: lr: 0.0000100: loss=45.715862 val_acc=0.4289617 val_loss=43.9893723
2025-09-08 06:43:35 INFO epoch 0137/200: lr: 0.0000100: loss=45.675962 val_acc=0.4262295 val_loss=43.9468002
2025-09-08 06:43:35 INFO epoch 0138/200: lr: 0.0000100: loss=45.639533 val_acc=0.4289617 val_loss=43.9185677
2025-09-08 06:43:35 INFO epoch 0139/200: lr: 0.0000100: loss=45.600246 val_acc=0.4289617 val_loss=43.8869743
2025-09-08 06:43:35 INFO epoch 0140/200: lr: 0.0000100: loss=45.563008 val_acc=0.4303279 val_loss=43.8528290
2025-09-08 06:43:35 INFO epoch 0141/200: lr: 0.0000100: loss=45.524428 val_acc=0.4316940 val_loss=43.8315468
2025-09-08 06:43:35 INFO epoch 0142/200: lr: 0.0000100: loss=45.487687 val_acc=0.4289617 val_loss=43.8028946
2025-09-08 06:43:35 INFO epoch 0143/200: lr: 0.0000100: loss=45.450244 val_acc=0.4316940 val_loss=43.7823868
2025-09-08 06:43:35 INFO epoch 0144/200: lr: 0.0000100: loss=45.416667 val_acc=0.4330601 val_loss=43.7473755
2025-09-08 06:43:35 INFO epoch 0145/200: lr: 0.0000100: loss=45.377260 val_acc=0.4330601 val_loss=43.7138519
2025-09-08 06:43:35 INFO epoch 0146/200: lr: 0.0000100: loss=45.340896 val_acc=0.4316940 val_loss=43.6925125
2025-09-08 06:43:35 INFO epoch 0147/200: lr: 0.0000100: loss=45.307319 val_acc=0.4316940 val_loss=43.6688004
2025-09-08 06:43:35 INFO epoch 0148/200: lr: 0.0000100: loss=45.271434 val_acc=0.4330601 val_loss=43.6372757
2025-09-08 06:43:35 INFO epoch 0149/200: lr: 0.0000100: loss=45.234195 val_acc=0.4344262 val_loss=43.6079407
2025-09-08 06:43:35 INFO epoch 0150/200: lr: 0.0000100: loss=45.198727 val_acc=0.4316940 val_loss=43.5936050
2025-09-08 06:43:35 INFO epoch 0151/200: lr: 0.0000100: loss=45.164653 val_acc=0.4357923 val_loss=43.5700111
2025-09-08 06:43:35 INFO epoch 0152/200: lr: 0.0000100: loss=45.129266 val_acc=0.4357923 val_loss=43.5408173
2025-09-08 06:43:35 INFO epoch 0153/200: lr: 0.0000100: loss=45.095101 val_acc=0.4344262 val_loss=43.5112038
2025-09-08 06:43:36 INFO epoch 0154/200: lr: 0.0000100: loss=45.060859 val_acc=0.4371585 val_loss=43.4902306
2025-09-08 06:43:36 INFO epoch 0155/200: lr: 0.0000100: loss=45.026981 val_acc=0.4371585 val_loss=43.4662514
2025-09-08 06:43:36 INFO epoch 0156/200: lr: 0.0000100: loss=44.996751 val_acc=0.4371585 val_loss=43.4430656
2025-09-08 06:43:36 INFO epoch 0157/200: lr: 0.0000100: loss=44.962587 val_acc=0.4357923 val_loss=43.4085999
2025-09-08 06:43:36 INFO epoch 0158/200: lr: 0.0000100: loss=44.926311 val_acc=0.4344262 val_loss=43.3917694
2025-09-08 06:43:36 INFO epoch 0159/200: lr: 0.0000100: loss=44.892837 val_acc=0.4357923 val_loss=43.3640518
2025-09-08 06:43:36 INFO epoch 0160/200: lr: 0.0000100: loss=44.859225 val_acc=0.4385246 val_loss=43.3400497
2025-09-08 06:43:36 INFO epoch 0161/200: lr: 0.0000100: loss=44.825452 val_acc=0.4385246 val_loss=43.3224907
2025-09-08 06:43:36 INFO epoch 0162/200: lr: 0.0000100: loss=44.794312 val_acc=0.4412568 val_loss=43.3011932
2025-09-08 06:43:36 INFO epoch 0163/200: lr: 0.0000100: loss=44.763012 val_acc=0.4398907 val_loss=43.2785263
2025-09-08 06:43:36 INFO epoch 0164/200: lr: 0.0000100: loss=44.730765 val_acc=0.4398907 val_loss=43.2500763
2025-09-08 06:43:36 INFO epoch 0165/200: lr: 0.0000100: loss=44.700221 val_acc=0.4439891 val_loss=43.2330894
2025-09-08 06:43:36 INFO epoch 0166/200: lr: 0.0000100: loss=44.668409 val_acc=0.4385246 val_loss=43.2002563
2025-09-08 06:43:36 INFO epoch 0167/200: lr: 0.0000100: loss=44.634387 val_acc=0.4398907 val_loss=43.1803703
2025-09-08 06:43:36 INFO epoch 0168/200: lr: 0.0000100: loss=44.603860 val_acc=0.4398907 val_loss=43.1650009
2025-09-08 06:43:36 INFO epoch 0169/200: lr: 0.0000100: loss=44.572497 val_acc=0.4398907 val_loss=43.1350784
2025-09-08 06:43:36 INFO epoch 0170/200: lr: 0.0000100: loss=44.542552 val_acc=0.4412568 val_loss=43.1076088
2025-09-08 06:43:37 INFO epoch 0171/200: lr: 0.0000100: loss=44.512276 val_acc=0.4398907 val_loss=43.0932541
2025-09-08 06:43:37 INFO epoch 0172/200: lr: 0.0000100: loss=44.480481 val_acc=0.4398907 val_loss=43.0768585
2025-09-08 06:43:37 INFO epoch 0173/200: lr: 0.0000100: loss=44.449767 val_acc=0.4398907 val_loss=43.0456619
2025-09-08 06:43:37 INFO epoch 0174/200: lr: 0.0000100: loss=44.419280 val_acc=0.4398907 val_loss=43.0191383
2025-09-08 06:43:37 INFO epoch 0175/200: lr: 0.0000100: loss=44.390283 val_acc=0.4426230 val_loss=43.0088921
2025-09-08 06:43:37 INFO epoch 0176/200: lr: 0.0000100: loss=44.359595 val_acc=0.4412568 val_loss=42.9896660
2025-09-08 06:43:37 INFO epoch 0177/200: lr: 0.0000100: loss=44.330620 val_acc=0.4426230 val_loss=42.9628181
2025-09-08 06:43:37 INFO epoch 0178/200: lr: 0.0000100: loss=44.298612 val_acc=0.4426230 val_loss=42.9364395
2025-09-08 06:43:37 INFO epoch 0179/200: lr: 0.0000100: loss=44.270781 val_acc=0.4426230 val_loss=42.9202843
2025-09-08 06:43:37 INFO epoch 0180/200: lr: 0.0000100: loss=44.241712 val_acc=0.4412568 val_loss=42.8949394
2025-09-08 06:43:37 INFO epoch 0181/200: lr: 0.0000100: loss=44.212486 val_acc=0.4412568 val_loss=42.8677368
2025-09-08 06:43:37 INFO epoch 0182/200: lr: 0.0000100: loss=44.184158 val_acc=0.4412568 val_loss=42.8505592
2025-09-08 06:43:37 INFO epoch 0183/200: lr: 0.0000100: loss=44.155051 val_acc=0.4412568 val_loss=42.8380508
2025-09-08 06:43:37 INFO epoch 0184/200: lr: 0.0000100: loss=44.126198 val_acc=0.4412568 val_loss=42.8258896
2025-09-08 06:43:38 INFO epoch 0185/200: lr: 0.0000100: loss=44.099080 val_acc=0.4426230 val_loss=42.7947617
2025-09-08 06:43:38 INFO Training complete in 0m 12s
2025-09-08 06:43:38 INFO Best val_acc@165 = 0.44398907103825136
2025-09-08 06:43:38 INFO Best val_loss@165 = 43.233089447021484
2025-09-08 06:43:38 INFO  stats|test: mean=0.0003, std=1.0572
2025-09-08 06:43:38 INFO Linear evaluation: default_0_2025-09-05_16-17-52-checkpoint_last_cremad_182d7c3e cremad -> 0.45648
{'audio_repr': 'ar_eat.AR_EAT', 'weight_file': '/opt/gpfs/home/chushu/exp/eat/pre_4_AS2M/default_0_2025-09-05_16-17-52/checkpoint_last.pt', 'feature_d': 768, 'sample_rate': 16000, 'target_length': 1024, 'framework': 'fairseq', 'mode': 'finetune', 'prediction_mode': 'CLS_TOKEN', 'model_dir': '/opt/gpfs/home/chushu/codes/2506/EAT/EAT', 'batch_size': 16, 'lr_lineareval': 3e-05, 'report_per_epochs': 50, 'early_stop_epochs': 20, 'training_mask': 0.0, 'warmup_epochs': 5, 'mixup': 0.5, 'ft_bs': 128, 'ft_lr': 2.0, 'ft_early_stop_epochs': -1, 'ft_epochs': 200, 'ft_freq_mask': 30, 'ft_time_mask': 192, 'ft_noise': 0.0, 'ft_rrc': True, 'name': '', 'task_metadata': '/opt/gpfs/home/chushu/codes/2506/EAT/evar/evar/metadata/cremad.csv', 'task_data': '/opt/gpfs/data/raw_data/cremad/16k', 'unit_samples': 40000, 'id': 'default_0_2025-09-05_16-17-52-checkpoint_last_cremad_764ad5e5', 'task_name': 'cremad', 'return_filename': False, 'mean': None, 'std': None, 'runtime_cfg': {'lr': 1e-05, 'seed': 43, 'hidden': (), 'standard_scaler': True, 'mixup': False, 'epochs': 200, 'early_stop_epochs': 20, 'id': '7d7f1d32'}}
/opt/gpfs/home/chushu/codes/2506/EAT/evar/logs/default_0_2025-09-05_16-17-52-checkpoint_last_cremad_764ad5e5/default-0-2025-09-05-16-17-52-checkpoint-last-cremad-LE_182d7c3e_0.45648.csv
2025-09-08 06:43:38 INFO  -> /opt/gpfs/home/chushu/codes/2506/EAT/evar/results/scores.csv
2025-09-08 06:43:43 INFO {'audio_repr': 'ar_eat.AR_EAT', 'weight_file': '/opt/gpfs/home/chushu/exp/eat/pre_4_AS2M/default_0_2025-09-05_16-17-52/checkpoint_last.pt', 'feature_d': 768, 'sample_rate': 16000, 'target_length': 1024, 'framework': 'fairseq', 'mode': 'finetune', 'prediction_mode': 'CLS_TOKEN', 'model_dir': '/opt/gpfs/home/chushu/codes/2506/EAT/EAT', 'batch_size': 16, 'lr_lineareval': 3e-05, 'report_per_epochs': 50, 'early_stop_epochs': 20, 'training_mask': 0.0, 'warmup_epochs': 5, 'mixup': 0.5, 'ft_bs': 128, 'ft_lr': 2.0, 'ft_early_stop_epochs': -1, 'ft_epochs': 200, 'ft_freq_mask': 30, 'ft_time_mask': 192, 'ft_noise': 0.0, 'ft_rrc': True, 'name': '', 'task_metadata': '/opt/gpfs/home/chushu/codes/2506/EAT/evar/evar/metadata/cremad.csv', 'task_data': '/opt/gpfs/data/raw_data/cremad/16k', 'unit_samples': 40000, 'id': 'default_0_2025-09-05_16-17-52-checkpoint_last_cremad_764ad5e5', 'task_name': 'cremad', 'return_filename': False, 'mean': None, 'std': None, 'runtime_cfg': {'lr': 1e-05, 'seed': 44, 'hidden': (), 'standard_scaler': True, 'mixup': False, 'epochs': 200, 'early_stop_epochs': 20, 'id': 'cb151996'}}
2025-09-08 06:43:43 INFO  classes: ['ANG', 'DIS', 'FEA', 'HAP', 'NEU', 'SAD']
2025-09-08 06:43:43 INFO Train:5155, valid:732, test:1551, multi label:False
2025-09-08 06:43:43 INFO  using cached embeddings: embs-default_0_2025-09-05_16-17-52-checkpoint_last_cremad_764ad5e5-train-1
2025-09-08 06:43:43 INFO  using cached embeddings: embs-default_0_2025-09-05_16-17-52-checkpoint_last_cremad_764ad5e5-valid-1
2025-09-08 06:43:43 INFO  using cached embeddings: embs-default_0_2025-09-05_16-17-52-checkpoint_last_cremad_764ad5e5-test-1
2025-09-08 06:43:43 INFO 🚀 Started Linear evaluation:
2025-09-08 06:43:43 INFO  stats|train: mean=0.0000, std=1.0000
2025-09-08 06:43:43 INFO  stats|valid: mean=-0.0012, std=1.0562
2025-09-08 06:43:44 INFO Training model: MLP(
  (mlp): Sequential(
    (0): Linear(in_features=768, out_features=6, bias=True)
  )
)
2025-09-08 06:43:44 INFO Details - metric: acc, loss: <function loss_nll_with_logits at 0x7f214b1609d0>, optimizer: Adam (
Parameter Group 0
    amsgrad: False
    betas: (0.9, 0.999)
    capturable: False
    decoupled_weight_decay: False
    differentiable: False
    eps: 1e-08
    foreach: None
    fused: None
    lr: 1e-05
    maximize: False
    weight_decay: 1e-08
), n_class: 6
2025-09-08 06:43:44 INFO epoch 0001/200: lr: 0.0000100: loss=60.639387 val_acc=0.1830601 val_loss=56.5141373
2025-09-08 06:43:44 INFO epoch 0002/200: lr: 0.0000100: loss=60.081401 val_acc=0.1939891 val_loss=56.0257187
2025-09-08 06:43:44 INFO epoch 0003/200: lr: 0.0000100: loss=59.596795 val_acc=0.2049180 val_loss=55.6052780
2025-09-08 06:43:44 INFO epoch 0004/200: lr: 0.0000100: loss=59.166183 val_acc=0.2213115 val_loss=55.2137375
2025-09-08 06:43:44 INFO epoch 0005/200: lr: 0.0000100: loss=58.773490 val_acc=0.2295082 val_loss=54.8551598
2025-09-08 06:43:44 INFO epoch 0006/200: lr: 0.0000100: loss=58.409769 val_acc=0.2363388 val_loss=54.5241165
2025-09-08 06:43:44 INFO epoch 0007/200: lr: 0.0000100: loss=58.069294 val_acc=0.2445355 val_loss=54.2069206
2025-09-08 06:43:44 INFO epoch 0008/200: lr: 0.0000100: loss=57.744895 val_acc=0.2500000 val_loss=53.9129333
2025-09-08 06:43:44 INFO epoch 0009/200: lr: 0.0000100: loss=57.442485 val_acc=0.2554645 val_loss=53.6309891
2025-09-08 06:43:45 INFO epoch 0010/200: lr: 0.0000100: loss=57.148276 val_acc=0.2663934 val_loss=53.3659973
2025-09-08 06:43:45 INFO epoch 0011/200: lr: 0.0000100: loss=56.865949 val_acc=0.2732240 val_loss=53.1079254
2025-09-08 06:43:45 INFO epoch 0012/200: lr: 0.0000100: loss=56.598077 val_acc=0.2732240 val_loss=52.8652573
2025-09-08 06:43:45 INFO epoch 0013/200: lr: 0.0000100: loss=56.338941 val_acc=0.2800546 val_loss=52.6304131
2025-09-08 06:43:45 INFO epoch 0014/200: lr: 0.0000100: loss=56.088530 val_acc=0.2841530 val_loss=52.4077835
2025-09-08 06:43:45 INFO epoch 0015/200: lr: 0.0000100: loss=55.850139 val_acc=0.2896175 val_loss=52.1924820
2025-09-08 06:43:45 INFO epoch 0016/200: lr: 0.0000100: loss=55.616948 val_acc=0.2923497 val_loss=51.9881096
2025-09-08 06:43:45 INFO epoch 0017/200: lr: 0.0000100: loss=55.393929 val_acc=0.2950820 val_loss=51.7912292
2025-09-08 06:43:45 INFO epoch 0018/200: lr: 0.0000100: loss=55.176654 val_acc=0.3005464 val_loss=51.6041641
2025-09-08 06:43:45 INFO epoch 0019/200: lr: 0.0000100: loss=54.966658 val_acc=0.3073770 val_loss=51.4184570
2025-09-08 06:43:45 INFO epoch 0020/200: lr: 0.0000100: loss=54.765362 val_acc=0.3169399 val_loss=51.2489319
2025-09-08 06:43:45 INFO epoch 0021/200: lr: 0.0000100: loss=54.567161 val_acc=0.3224044 val_loss=51.0837860
2025-09-08 06:43:45 INFO epoch 0022/200: lr: 0.0000100: loss=54.379209 val_acc=0.3251366 val_loss=50.9150848
2025-09-08 06:43:45 INFO epoch 0023/200: lr: 0.0000100: loss=54.194027 val_acc=0.3265027 val_loss=50.7514420
2025-09-08 06:43:45 INFO epoch 0024/200: lr: 0.0000100: loss=54.014759 val_acc=0.3306011 val_loss=50.6035080
2025-09-08 06:43:45 INFO epoch 0025/200: lr: 0.0000100: loss=53.839185 val_acc=0.3346995 val_loss=50.4585953
2025-09-08 06:43:46 INFO epoch 0026/200: lr: 0.0000100: loss=53.670319 val_acc=0.3387978 val_loss=50.3084450
2025-09-08 06:43:46 INFO epoch 0027/200: lr: 0.0000100: loss=53.506055 val_acc=0.3360656 val_loss=50.1764336
2025-09-08 06:43:46 INFO epoch 0028/200: lr: 0.0000100: loss=53.347645 val_acc=0.3374317 val_loss=50.0322876
2025-09-08 06:43:46 INFO epoch 0029/200: lr: 0.0000100: loss=53.191742 val_acc=0.3469945 val_loss=49.9084015
2025-09-08 06:43:46 INFO epoch 0030/200: lr: 0.0000100: loss=53.039901 val_acc=0.3483607 val_loss=49.7819557
2025-09-08 06:43:46 INFO epoch 0031/200: lr: 0.0000100: loss=52.892953 val_acc=0.3469945 val_loss=49.6533432
2025-09-08 06:43:46 INFO epoch 0032/200: lr: 0.0000100: loss=52.749658 val_acc=0.3469945 val_loss=49.5357780
2025-09-08 06:43:46 INFO epoch 0033/200: lr: 0.0000100: loss=52.608570 val_acc=0.3483607 val_loss=49.4110107
2025-09-08 06:43:46 INFO epoch 0034/200: lr: 0.0000100: loss=52.471158 val_acc=0.3565574 val_loss=49.3004074
2025-09-08 06:43:46 INFO epoch 0035/200: lr: 0.0000100: loss=52.337538 val_acc=0.3579235 val_loss=49.1925049
2025-09-08 06:43:46 INFO epoch 0036/200: lr: 0.0000100: loss=52.207942 val_acc=0.3661202 val_loss=49.0861053
2025-09-08 06:43:46 INFO epoch 0037/200: lr: 0.0000100: loss=52.078824 val_acc=0.3688525 val_loss=48.9815636
2025-09-08 06:43:46 INFO epoch 0038/200: lr: 0.0000100: loss=51.954597 val_acc=0.3743169 val_loss=48.8815002
2025-09-08 06:43:47 INFO epoch 0039/200: lr: 0.0000100: loss=51.832212 val_acc=0.3715847 val_loss=48.7786865
2025-09-08 06:43:47 INFO epoch 0040/200: lr: 0.0000100: loss=51.713827 val_acc=0.3743169 val_loss=48.6765480
2025-09-08 06:43:47 INFO epoch 0041/200: lr: 0.0000100: loss=51.596614 val_acc=0.3756831 val_loss=48.5838585
2025-09-08 06:43:47 INFO epoch 0042/200: lr: 0.0000100: loss=51.482161 val_acc=0.3770492 val_loss=48.4897308
2025-09-08 06:43:47 INFO epoch 0043/200: lr: 0.0000100: loss=51.370375 val_acc=0.3743169 val_loss=48.3895760
2025-09-08 06:43:47 INFO epoch 0044/200: lr: 0.0000100: loss=51.259926 val_acc=0.3743169 val_loss=48.3112030
2025-09-08 06:43:47 INFO epoch 0045/200: lr: 0.0000100: loss=51.153880 val_acc=0.3743169 val_loss=48.2171936
2025-09-08 06:43:47 INFO epoch 0046/200: lr: 0.0000100: loss=51.047655 val_acc=0.3756831 val_loss=48.1388054
2025-09-08 06:43:47 INFO epoch 0047/200: lr: 0.0000100: loss=50.942621 val_acc=0.3743169 val_loss=48.0543938
2025-09-08 06:43:47 INFO epoch 0048/200: lr: 0.0000100: loss=50.840590 val_acc=0.3756831 val_loss=47.9751511
2025-09-08 06:43:47 INFO epoch 0049/200: lr: 0.0000100: loss=50.742842 val_acc=0.3811475 val_loss=47.8999329
2025-09-08 06:43:47 INFO epoch 0050/200: lr: 0.0000100: loss=50.642638 val_acc=0.3825137 val_loss=47.8116226
2025-09-08 06:43:47 INFO epoch 0051/200: lr: 0.0000100: loss=50.550157 val_acc=0.3852459 val_loss=47.7289429
2025-09-08 06:43:47 INFO epoch 0052/200: lr: 0.0000100: loss=50.455378 val_acc=0.3866120 val_loss=47.6484909
2025-09-08 06:43:47 INFO epoch 0053/200: lr: 0.0000100: loss=50.361338 val_acc=0.3879781 val_loss=47.5791092
2025-09-08 06:43:47 INFO epoch 0054/200: lr: 0.0000100: loss=50.270152 val_acc=0.3920765 val_loss=47.5045624
2025-09-08 06:43:48 INFO epoch 0055/200: lr: 0.0000100: loss=50.180583 val_acc=0.3907104 val_loss=47.4307251
2025-09-08 06:43:48 INFO epoch 0056/200: lr: 0.0000100: loss=50.096360 val_acc=0.3920765 val_loss=47.3627014
2025-09-08 06:43:48 INFO epoch 0057/200: lr: 0.0000100: loss=50.007199 val_acc=0.3879781 val_loss=47.2987289
2025-09-08 06:43:48 INFO epoch 0058/200: lr: 0.0000100: loss=49.923033 val_acc=0.3852459 val_loss=47.2221832
2025-09-08 06:43:48 INFO epoch 0059/200: lr: 0.0000100: loss=49.838074 val_acc=0.3907104 val_loss=47.1606216
2025-09-08 06:43:48 INFO epoch 0060/200: lr: 0.0000100: loss=49.756294 val_acc=0.3989071 val_loss=47.0851440
2025-09-08 06:43:48 INFO epoch 0061/200: lr: 0.0000100: loss=49.675302 val_acc=0.3948087 val_loss=47.0300331
2025-09-08 06:43:48 INFO epoch 0062/200: lr: 0.0000100: loss=49.595286 val_acc=0.4002732 val_loss=46.9624252
2025-09-08 06:43:48 INFO epoch 0063/200: lr: 0.0000100: loss=49.517912 val_acc=0.4016393 val_loss=46.9058762
2025-09-08 06:43:48 INFO epoch 0064/200: lr: 0.0000100: loss=49.438164 val_acc=0.4016393 val_loss=46.8344421
2025-09-08 06:43:48 INFO epoch 0065/200: lr: 0.0000100: loss=49.364144 val_acc=0.4057377 val_loss=46.7733459
2025-09-08 06:43:48 INFO epoch 0066/200: lr: 0.0000100: loss=49.289244 val_acc=0.4084699 val_loss=46.7174911
2025-09-08 06:43:48 INFO epoch 0067/200: lr: 0.0000100: loss=49.213549 val_acc=0.4098361 val_loss=46.6591721
2025-09-08 06:43:48 INFO epoch 0068/200: lr: 0.0000100: loss=49.139632 val_acc=0.4071038 val_loss=46.5996552
2025-09-08 06:43:48 INFO epoch 0069/200: lr: 0.0000100: loss=49.067338 val_acc=0.4071038 val_loss=46.5422974
2025-09-08 06:43:48 INFO epoch 0070/200: lr: 0.0000100: loss=48.997557 val_acc=0.4084699 val_loss=46.4817390
2025-09-08 06:43:49 INFO epoch 0071/200: lr: 0.0000100: loss=48.927177 val_acc=0.4125683 val_loss=46.4229050
2025-09-08 06:43:49 INFO epoch 0072/200: lr: 0.0000100: loss=48.859550 val_acc=0.4139344 val_loss=46.3687744
2025-09-08 06:43:49 INFO epoch 0073/200: lr: 0.0000100: loss=48.788985 val_acc=0.4139344 val_loss=46.3101120
2025-09-08 06:43:49 INFO epoch 0074/200: lr: 0.0000100: loss=48.723791 val_acc=0.4139344 val_loss=46.2618065
2025-09-08 06:43:49 INFO epoch 0075/200: lr: 0.0000100: loss=48.657455 val_acc=0.4166667 val_loss=46.2049179
2025-09-08 06:43:49 INFO epoch 0076/200: lr: 0.0000100: loss=48.592004 val_acc=0.4153005 val_loss=46.1540451
2025-09-08 06:43:49 INFO epoch 0077/200: lr: 0.0000100: loss=48.526461 val_acc=0.4193989 val_loss=46.1032906
2025-09-08 06:43:49 INFO epoch 0078/200: lr: 0.0000100: loss=48.460624 val_acc=0.4180328 val_loss=46.0518188
2025-09-08 06:43:49 INFO epoch 0079/200: lr: 0.0000100: loss=48.397765 val_acc=0.4153005 val_loss=45.9954376
2025-09-08 06:43:49 INFO epoch 0080/200: lr: 0.0000100: loss=48.334768 val_acc=0.4139344 val_loss=45.9539528
2025-09-08 06:43:49 INFO epoch 0081/200: lr: 0.0000100: loss=48.275540 val_acc=0.4193989 val_loss=45.9034843
2025-09-08 06:43:49 INFO epoch 0082/200: lr: 0.0000100: loss=48.212802 val_acc=0.4193989 val_loss=45.8582764
2025-09-08 06:43:49 INFO epoch 0083/200: lr: 0.0000100: loss=48.153741 val_acc=0.4207650 val_loss=45.7932663
2025-09-08 06:43:49 INFO epoch 0084/200: lr: 0.0000100: loss=48.092642 val_acc=0.4207650 val_loss=45.7545738
2025-09-08 06:43:49 INFO epoch 0085/200: lr: 0.0000100: loss=48.033976 val_acc=0.4262295 val_loss=45.7125206
2025-09-08 06:43:49 INFO epoch 0086/200: lr: 0.0000100: loss=47.975686 val_acc=0.4234973 val_loss=45.6602325
2025-09-08 06:43:50 INFO epoch 0087/200: lr: 0.0000100: loss=47.919537 val_acc=0.4248634 val_loss=45.6122398
2025-09-08 06:43:50 INFO epoch 0088/200: lr: 0.0000100: loss=47.860984 val_acc=0.4262295 val_loss=45.5740852
2025-09-08 06:43:50 INFO epoch 0089/200: lr: 0.0000100: loss=47.808225 val_acc=0.4275956 val_loss=45.5279083
2025-09-08 06:43:50 INFO epoch 0090/200: lr: 0.0000100: loss=47.749426 val_acc=0.4262295 val_loss=45.4893684
2025-09-08 06:43:50 INFO epoch 0091/200: lr: 0.0000100: loss=47.694637 val_acc=0.4262295 val_loss=45.4430237
2025-09-08 06:43:50 INFO epoch 0092/200: lr: 0.0000100: loss=47.639035 val_acc=0.4262295 val_loss=45.3968353
2025-09-08 06:43:50 INFO epoch 0093/200: lr: 0.0000100: loss=47.586375 val_acc=0.4316940 val_loss=45.3586540
2025-09-08 06:43:50 INFO epoch 0094/200: lr: 0.0000100: loss=47.532043 val_acc=0.4316940 val_loss=45.3145065
2025-09-08 06:43:50 INFO epoch 0095/200: lr: 0.0000100: loss=47.479604 val_acc=0.4316940 val_loss=45.2683716
2025-09-08 06:43:50 INFO epoch 0096/200: lr: 0.0000100: loss=47.426967 val_acc=0.4303279 val_loss=45.2310600
2025-09-08 06:43:50 INFO epoch 0097/200: lr: 0.0000100: loss=47.374923 val_acc=0.4330601 val_loss=45.1810951
2025-09-08 06:43:50 INFO epoch 0098/200: lr: 0.0000100: loss=47.323734 val_acc=0.4303279 val_loss=45.1499214
2025-09-08 06:43:50 INFO epoch 0099/200: lr: 0.0000100: loss=47.275951 val_acc=0.4330601 val_loss=45.1096497
2025-09-08 06:43:50 INFO epoch 0100/200: lr: 0.0000100: loss=47.224447 val_acc=0.4316940 val_loss=45.0720482
2025-09-08 06:43:50 INFO epoch 0101/200: lr: 0.0000100: loss=47.173732 val_acc=0.4316940 val_loss=45.0248718
2025-09-08 06:43:50 INFO epoch 0102/200: lr: 0.0000100: loss=47.125221 val_acc=0.4316940 val_loss=44.9921379
2025-09-08 06:43:51 INFO epoch 0103/200: lr: 0.0000100: loss=47.076737 val_acc=0.4316940 val_loss=44.9472351
2025-09-08 06:43:51 INFO epoch 0104/200: lr: 0.0000100: loss=47.028342 val_acc=0.4344262 val_loss=44.9176941
2025-09-08 06:43:51 INFO epoch 0105/200: lr: 0.0000100: loss=46.981089 val_acc=0.4330601 val_loss=44.8695831
2025-09-08 06:43:51 INFO epoch 0106/200: lr: 0.0000100: loss=46.932941 val_acc=0.4357923 val_loss=44.8368492
2025-09-08 06:43:51 INFO epoch 0107/200: lr: 0.0000100: loss=46.885230 val_acc=0.4344262 val_loss=44.8025246
2025-09-08 06:43:51 INFO epoch 0108/200: lr: 0.0000100: loss=46.839777 val_acc=0.4316940 val_loss=44.7649307
2025-09-08 06:43:51 INFO epoch 0109/200: lr: 0.0000100: loss=46.792885 val_acc=0.4344262 val_loss=44.7366791
2025-09-08 06:43:51 INFO epoch 0110/200: lr: 0.0000100: loss=46.745049 val_acc=0.4330601 val_loss=44.6992035
2025-09-08 06:43:51 INFO epoch 0111/200: lr: 0.0000100: loss=46.702283 val_acc=0.4316940 val_loss=44.6553421
2025-09-08 06:43:51 INFO epoch 0112/200: lr: 0.0000100: loss=46.656432 val_acc=0.4316940 val_loss=44.6272659
2025-09-08 06:43:51 INFO epoch 0113/200: lr: 0.0000100: loss=46.613125 val_acc=0.4330601 val_loss=44.5921860
2025-09-08 06:43:51 INFO epoch 0114/200: lr: 0.0000100: loss=46.568146 val_acc=0.4344262 val_loss=44.5529022
2025-09-08 06:43:51 INFO epoch 0115/200: lr: 0.0000100: loss=46.527508 val_acc=0.4316940 val_loss=44.5219612
2025-09-08 06:43:51 INFO epoch 0116/200: lr: 0.0000100: loss=46.479341 val_acc=0.4330601 val_loss=44.4922905
2025-09-08 06:43:52 INFO epoch 0117/200: lr: 0.0000100: loss=46.437871 val_acc=0.4316940 val_loss=44.4583588
2025-09-08 06:43:52 INFO epoch 0118/200: lr: 0.0000100: loss=46.393013 val_acc=0.4357923 val_loss=44.4198456
2025-09-08 06:43:52 INFO epoch 0119/200: lr: 0.0000100: loss=46.351963 val_acc=0.4371585 val_loss=44.3906898
2025-09-08 06:43:52 INFO epoch 0120/200: lr: 0.0000100: loss=46.309058 val_acc=0.4344262 val_loss=44.3566895
2025-09-08 06:43:52 INFO epoch 0121/200: lr: 0.0000100: loss=46.267826 val_acc=0.4357923 val_loss=44.3327179
2025-09-08 06:43:52 INFO epoch 0122/200: lr: 0.0000100: loss=46.226186 val_acc=0.4398907 val_loss=44.2928810
2025-09-08 06:43:52 INFO epoch 0123/200: lr: 0.0000100: loss=46.186491 val_acc=0.4398907 val_loss=44.2655487
2025-09-08 06:43:52 INFO epoch 0124/200: lr: 0.0000100: loss=46.145011 val_acc=0.4398907 val_loss=44.2255554
2025-09-08 06:43:52 INFO epoch 0125/200: lr: 0.0000100: loss=46.104601 val_acc=0.4412568 val_loss=44.1994400
2025-09-08 06:43:52 INFO epoch 0126/200: lr: 0.0000100: loss=46.067192 val_acc=0.4398907 val_loss=44.1579895
2025-09-08 06:43:52 INFO epoch 0127/200: lr: 0.0000100: loss=46.023502 val_acc=0.4412568 val_loss=44.1321907
2025-09-08 06:43:52 INFO epoch 0128/200: lr: 0.0000100: loss=45.984497 val_acc=0.4412568 val_loss=44.1046829
2025-09-08 06:43:52 INFO epoch 0129/200: lr: 0.0000100: loss=45.945679 val_acc=0.4412568 val_loss=44.0791779
2025-09-08 06:43:52 INFO epoch 0130/200: lr: 0.0000100: loss=45.906498 val_acc=0.4426230 val_loss=44.0453491
2025-09-08 06:43:52 INFO epoch 0131/200: lr: 0.0000100: loss=45.866645 val_acc=0.4398907 val_loss=44.0182419
2025-09-08 06:43:52 INFO epoch 0132/200: lr: 0.0000100: loss=45.829414 val_acc=0.4398907 val_loss=43.9869080
2025-09-08 06:43:52 INFO epoch 0133/200: lr: 0.0000100: loss=45.791201 val_acc=0.4398907 val_loss=43.9536438
2025-09-08 06:43:53 INFO epoch 0134/200: lr: 0.0000100: loss=45.753150 val_acc=0.4385246 val_loss=43.9379387
2025-09-08 06:43:53 INFO epoch 0135/200: lr: 0.0000100: loss=45.715754 val_acc=0.4398907 val_loss=43.9044838
2025-09-08 06:43:53 INFO epoch 0136/200: lr: 0.0000100: loss=45.678532 val_acc=0.4412568 val_loss=43.8762894
2025-09-08 06:43:53 INFO epoch 0137/200: lr: 0.0000100: loss=45.642711 val_acc=0.4398907 val_loss=43.8410683
2025-09-08 06:43:53 INFO epoch 0138/200: lr: 0.0000100: loss=45.606440 val_acc=0.4426230 val_loss=43.8242722
2025-09-08 06:43:53 INFO epoch 0139/200: lr: 0.0000100: loss=45.568120 val_acc=0.4385246 val_loss=43.7955017
2025-09-08 06:43:53 INFO epoch 0140/200: lr: 0.0000100: loss=45.533019 val_acc=0.4412568 val_loss=43.7734451
2025-09-08 06:43:53 INFO epoch 0141/200: lr: 0.0000100: loss=45.496215 val_acc=0.4385246 val_loss=43.7418175
2025-09-08 06:43:53 INFO epoch 0142/200: lr: 0.0000100: loss=45.460531 val_acc=0.4385246 val_loss=43.7181091
2025-09-08 06:43:53 INFO epoch 0143/200: lr: 0.0000100: loss=45.425997 val_acc=0.4398907 val_loss=43.6781197
2025-09-08 06:43:53 INFO epoch 0144/200: lr: 0.0000100: loss=45.388830 val_acc=0.4398907 val_loss=43.6596031
2025-09-08 06:43:53 INFO epoch 0145/200: lr: 0.0000100: loss=45.355056 val_acc=0.4412568 val_loss=43.6378059
2025-09-08 06:43:53 INFO epoch 0146/200: lr: 0.0000100: loss=45.320266 val_acc=0.4412568 val_loss=43.6029587
2025-09-08 06:43:53 INFO epoch 0147/200: lr: 0.0000100: loss=45.284832 val_acc=0.4398907 val_loss=43.5828857
2025-09-08 06:43:53 INFO epoch 0148/200: lr: 0.0000100: loss=45.249844 val_acc=0.4398907 val_loss=43.5571213
2025-09-08 06:43:53 INFO epoch 0149/200: lr: 0.0000100: loss=45.217070 val_acc=0.4426230 val_loss=43.5399551
2025-09-08 06:43:53 INFO epoch 0150/200: lr: 0.0000100: loss=45.182577 val_acc=0.4398907 val_loss=43.5083466
2025-09-08 06:43:54 INFO epoch 0151/200: lr: 0.0000100: loss=45.149500 val_acc=0.4385246 val_loss=43.4765358
2025-09-08 06:43:54 INFO epoch 0152/200: lr: 0.0000100: loss=45.117126 val_acc=0.4439891 val_loss=43.4605904
2025-09-08 06:43:54 INFO epoch 0153/200: lr: 0.0000100: loss=45.082702 val_acc=0.4439891 val_loss=43.4404297
2025-09-08 06:43:54 INFO epoch 0154/200: lr: 0.0000100: loss=45.049279 val_acc=0.4439891 val_loss=43.4118767
2025-09-08 06:43:54 INFO epoch 0155/200: lr: 0.0000100: loss=45.016073 val_acc=0.4467213 val_loss=43.3855858
2025-09-08 06:43:54 INFO epoch 0156/200: lr: 0.0000100: loss=44.984227 val_acc=0.4453552 val_loss=43.3668365
2025-09-08 06:43:54 INFO epoch 0157/200: lr: 0.0000100: loss=44.951849 val_acc=0.4467213 val_loss=43.3438568
2025-09-08 06:43:54 INFO epoch 0158/200: lr: 0.0000100: loss=44.919404 val_acc=0.4480874 val_loss=43.3096542
2025-09-08 06:43:54 INFO epoch 0159/200: lr: 0.0000100: loss=44.886165 val_acc=0.4480874 val_loss=43.2933311
2025-09-08 06:43:54 INFO epoch 0160/200: lr: 0.0000100: loss=44.855364 val_acc=0.4494536 val_loss=43.2627869
2025-09-08 06:43:54 INFO epoch 0161/200: lr: 0.0000100: loss=44.823578 val_acc=0.4494536 val_loss=43.2384377
2025-09-08 06:43:54 INFO epoch 0162/200: lr: 0.0000100: loss=44.791663 val_acc=0.4508197 val_loss=43.2288628
2025-09-08 06:43:54 INFO epoch 0163/200: lr: 0.0000100: loss=44.761690 val_acc=0.4508197 val_loss=43.2045555
2025-09-08 06:43:54 INFO epoch 0164/200: lr: 0.0000100: loss=44.730581 val_acc=0.4521858 val_loss=43.1719322
2025-09-08 06:43:54 INFO epoch 0165/200: lr: 0.0000100: loss=44.699671 val_acc=0.4521858 val_loss=43.1566315
2025-09-08 06:43:54 INFO epoch 0166/200: lr: 0.0000100: loss=44.669394 val_acc=0.4508197 val_loss=43.1337204
2025-09-08 06:43:55 INFO epoch 0167/200: lr: 0.0000100: loss=44.637709 val_acc=0.4535519 val_loss=43.1036835
2025-09-08 06:43:55 INFO epoch 0168/200: lr: 0.0000100: loss=44.610250 val_acc=0.4535519 val_loss=43.0927658
2025-09-08 06:43:55 INFO epoch 0169/200: lr: 0.0000100: loss=44.577911 val_acc=0.4521858 val_loss=43.0681915
2025-09-08 06:43:55 INFO epoch 0170/200: lr: 0.0000100: loss=44.546485 val_acc=0.4549180 val_loss=43.0457382
2025-09-08 06:43:55 INFO epoch 0171/200: lr: 0.0000100: loss=44.517715 val_acc=0.4535519 val_loss=43.0265121
2025-09-08 06:43:55 INFO epoch 0172/200: lr: 0.0000100: loss=44.487570 val_acc=0.4535519 val_loss=43.0074921
2025-09-08 06:43:55 INFO epoch 0173/200: lr: 0.0000100: loss=44.458298 val_acc=0.4549180 val_loss=42.9848366
2025-09-08 06:43:55 INFO epoch 0174/200: lr: 0.0000100: loss=44.431775 val_acc=0.4549180 val_loss=42.9642067
2025-09-08 06:43:55 INFO epoch 0175/200: lr: 0.0000100: loss=44.399514 val_acc=0.4549180 val_loss=42.9310303
2025-09-08 06:43:55 INFO epoch 0176/200: lr: 0.0000100: loss=44.368632 val_acc=0.4562842 val_loss=42.9201393
2025-09-08 06:43:55 INFO epoch 0177/200: lr: 0.0000100: loss=44.342021 val_acc=0.4576503 val_loss=42.8959770
2025-09-08 06:43:55 INFO epoch 0178/200: lr: 0.0000100: loss=44.311770 val_acc=0.4576503 val_loss=42.8813667
2025-09-08 06:43:55 INFO epoch 0179/200: lr: 0.0000100: loss=44.284671 val_acc=0.4576503 val_loss=42.8563919
2025-09-08 06:43:55 INFO epoch 0180/200: lr: 0.0000100: loss=44.254932 val_acc=0.4576503 val_loss=42.8376923
2025-09-08 06:43:56 INFO epoch 0181/200: lr: 0.0000100: loss=44.228878 val_acc=0.4590164 val_loss=42.8130455
2025-09-08 06:43:56 INFO epoch 0182/200: lr: 0.0000100: loss=44.200614 val_acc=0.4603825 val_loss=42.7968636
2025-09-08 06:43:56 INFO epoch 0183/200: lr: 0.0000100: loss=44.170490 val_acc=0.4603825 val_loss=42.7932053
2025-09-08 06:43:56 INFO epoch 0184/200: lr: 0.0000100: loss=44.141796 val_acc=0.4590164 val_loss=42.7593155
2025-09-08 06:43:56 INFO epoch 0185/200: lr: 0.0000100: loss=44.115667 val_acc=0.4590164 val_loss=42.7326622
2025-09-08 06:43:56 INFO epoch 0186/200: lr: 0.0000100: loss=44.090135 val_acc=0.4590164 val_loss=42.7279472
2025-09-08 06:43:56 INFO epoch 0187/200: lr: 0.0000100: loss=44.058876 val_acc=0.4590164 val_loss=42.6954193
2025-09-08 06:43:56 INFO epoch 0188/200: lr: 0.0000100: loss=44.033435 val_acc=0.4631148 val_loss=42.6768646
2025-09-08 06:43:56 INFO epoch 0189/200: lr: 0.0000100: loss=44.005531 val_acc=0.4631148 val_loss=42.6587677
2025-09-08 06:43:56 INFO epoch 0190/200: lr: 0.0000100: loss=43.977704 val_acc=0.4631148 val_loss=42.6410980
2025-09-08 06:43:56 INFO epoch 0191/200: lr: 0.0000100: loss=43.951018 val_acc=0.4658470 val_loss=42.6272125
2025-09-08 06:43:56 INFO epoch 0192/200: lr: 0.0000100: loss=43.926321 val_acc=0.4672131 val_loss=42.6012039
2025-09-08 06:43:56 INFO epoch 0193/200: lr: 0.0000100: loss=43.896899 val_acc=0.4644809 val_loss=42.5828781
2025-09-08 06:43:56 INFO epoch 0194/200: lr: 0.0000100: loss=43.873252 val_acc=0.4685792 val_loss=42.5698204
2025-09-08 06:43:56 INFO epoch 0195/200: lr: 0.0000100: loss=43.843882 val_acc=0.4631148 val_loss=42.5476952
2025-09-08 06:43:56 INFO epoch 0196/200: lr: 0.0000100: loss=43.818301 val_acc=0.4644809 val_loss=42.5259933
2025-09-08 06:43:56 INFO epoch 0197/200: lr: 0.0000100: loss=43.794740 val_acc=0.4672131 val_loss=42.5211754
2025-09-08 06:43:57 INFO epoch 0198/200: lr: 0.0000100: loss=43.768216 val_acc=0.4672131 val_loss=42.4976921
2025-09-08 06:43:57 INFO epoch 0199/200: lr: 0.0000100: loss=43.741105 val_acc=0.4672131 val_loss=42.4702950
2025-09-08 06:43:57 INFO epoch 0200/200: lr: 0.0000100: loss=43.714756 val_acc=0.4672131 val_loss=42.4638748
2025-09-08 06:43:57 INFO Training complete in 0m 13s
2025-09-08 06:43:57 INFO Best val_acc@194 = 0.4685792349726776
2025-09-08 06:43:57 INFO Best val_loss@194 = 42.569820404052734
2025-09-08 06:43:57 INFO  stats|test: mean=0.0003, std=1.0572
2025-09-08 06:43:57 INFO Linear evaluation: default_0_2025-09-05_16-17-52-checkpoint_last_cremad_43545494 cremad -> 0.45712
{'audio_repr': 'ar_eat.AR_EAT', 'weight_file': '/opt/gpfs/home/chushu/exp/eat/pre_4_AS2M/default_0_2025-09-05_16-17-52/checkpoint_last.pt', 'feature_d': 768, 'sample_rate': 16000, 'target_length': 1024, 'framework': 'fairseq', 'mode': 'finetune', 'prediction_mode': 'CLS_TOKEN', 'model_dir': '/opt/gpfs/home/chushu/codes/2506/EAT/EAT', 'batch_size': 16, 'lr_lineareval': 3e-05, 'report_per_epochs': 50, 'early_stop_epochs': 20, 'training_mask': 0.0, 'warmup_epochs': 5, 'mixup': 0.5, 'ft_bs': 128, 'ft_lr': 2.0, 'ft_early_stop_epochs': -1, 'ft_epochs': 200, 'ft_freq_mask': 30, 'ft_time_mask': 192, 'ft_noise': 0.0, 'ft_rrc': True, 'name': '', 'task_metadata': '/opt/gpfs/home/chushu/codes/2506/EAT/evar/evar/metadata/cremad.csv', 'task_data': '/opt/gpfs/data/raw_data/cremad/16k', 'unit_samples': 40000, 'id': 'default_0_2025-09-05_16-17-52-checkpoint_last_cremad_764ad5e5', 'task_name': 'cremad', 'return_filename': False, 'mean': None, 'std': None, 'runtime_cfg': {'lr': 1e-05, 'seed': 44, 'hidden': (), 'standard_scaler': True, 'mixup': False, 'epochs': 200, 'early_stop_epochs': 20, 'id': 'cb151996'}}
/opt/gpfs/home/chushu/codes/2506/EAT/evar/logs/default_0_2025-09-05_16-17-52-checkpoint_last_cremad_764ad5e5/default-0-2025-09-05-16-17-52-checkpoint-last-cremad-LE_43545494_0.45712.csv
2025-09-08 06:43:57 INFO  -> /opt/gpfs/home/chushu/codes/2506/EAT/evar/results/scores.csv
